台灣浤?生技製藥有限公司高雄市岡山區本洲工業區本工南一路18號,54e0cc90-6764-4592-847b-333ad38a10d1
台灣浤？生技製藥有限公司本洲廠高雄市岡山區本洲工業區本工南一路18號,54e0cc8e-145c-42f7-adc7-333ad38a10d1
台灣浤匯生技製藥有限公司本洲廠高雄市岡山區本洲工業區本工南一路18號,54e0cc95-4560-413d-9133-333ad38a10d1
台灣浤生技製藥有限公司本州廠高雄市岡山區本洲工業區本工南一路18號,54e0cc8f-bf8c-4be4-854d-333ad38a10d1
台灣浤生技製藥有限公司本洲廠高雄市岡山區本洲工業區本工南一路18號,54e0cc8e-2f88-4e23-baa8-333ad38a10d1
台灣浩鼎生技股份有限公司台北市南港區園區街3號19樓,54e0c4a7-d2c8-4de4-82b2-3fe5d38a10d1
台灣源山股份有限公司台北市大安區忠孝東路３段９８之１號５樓,54e0c49f-4ed4-487d-9202-3fe5d38a10d1
台灣漢藥生技股份有限公司台南市佳里區嘉福里115之1號,54e0cc8e-f654-42cb-bc8d-333ad38a10d1
台灣瓦格蘭股份有限公司台北巿大同區寧夏路161號1樓,54e0c4a0-8580-4d15-9704-3fe5d38a10d1
台灣百靈佳殷格翰股份有限公司台北市中山區民生東路三段49、51號12樓,54e0c4a6-3738-4229-bf91-3fe5d38a10d1
台灣神隆股份有限公司台南市善化區台南科學園區南科八路１號,54e0c49f-d008-4aa6-baa1-3fe5d38a10d1
台灣禮來股份有限公司台北市復興北路３６５號１１樓,54e0c499-bd70-41cc-8e11-3fe5d38a10d1
台灣第一三共股份有限公司台北市中山區八德路二段308號7樓之1,54e0c498-6b18-49c1-990c-3fe5d38a10d1
台灣羅氏醫療診斷設備股份有限公司台北市中山區民權東路3段2號10樓,54e0c498-0ed8-47f1-a65e-3fe5d38a10d1
台灣美強股份有限公司台北市中山區南京東路二段66號4樓,54e0c498-e840-4083-ba27-3fe5d38a10d1
台灣艾威群股份有限公司台北市大安區信義路三段149號15樓,54e0c498-f54c-4b3e-b9ae-3fe5d38a10d1
台灣艾所生物科技股份有限公司台北市大安區和平東路2段42號6樓,54e0c4a0-a13c-4c1b-b419-3fe5d38a10d1
台灣英特威動物藥品股份有限公司台北市信義區信義路五段106號12樓,54e0c4a6-ab40-42f3-904e-3fe5d38a10d1
台灣荃新股份有限公司台北市中正區羅斯福路二段11號3樓,54e0c498-beac-4240-8f2a-3fe5d38a10d1
台灣萌蒂藥品有限公司臺北市信義區松仁路32號14樓,54e0c498-07c8-428b-90cb-3fe5d38a10d1
台灣蔘鹿生物科技有限公司雲林縣斗南鎮明昌里二重溝62號,54e0cc90-7bc4-445f-9cbf-333ad38a10d1
台灣誠力藥業有限公司台中市南屯區黎明路一段1086巷10號1樓,54e0c4a1-0b64-4919-8cfb-3fe5d38a10d1
台灣諾和諾德藥品股份有限公司台北市敦化南路二段２１６號７樓－１,54e0c499-10d4-48bf-81d2-3fe5d38a10d1
台灣諾華股份有限公司台北市中正區仁愛路二段99號11、12、13樓,54e0c498-698c-47b4-ba71-3fe5d38a10d1
台灣費森尤斯卡比股份有限公司台北市大安區仁愛路三段30號5樓32號5樓,54e0c498-0eac-462b-9992-3fe5d38a10d1
台灣費森尤斯醫藥股份有限公司台北市內湖區瑞湖街58號7樓,54e0c4a3-1f6c-4f8b-ab59-3fe5d38a10d1
台灣邁蘭有限公司台北市內湖區民權東路六段160號8樓之3,54e0c498-519c-4106-b0fc-3fe5d38a10d1
台灣陽生製藥工業股份有限公司屏東市龍華里龍華路３８１號,54e0c497-1f10-4b02-a1b6-3fe5d38a10d1
台灣雅聞生技股份有限公司桃園縣楊梅鎮楊新路1段382巷68號1樓,54e0c49f-0ce0-43c8-b319-3fe5d38a10d1
台灣順安生物科技製藥有限公司高雄市大樹區龍目里龍目路130號,54e0cc8e-9c0c-4261-84f7-333ad38a10d1
台灣順安生物科技製藥有限公司大發廠高雄市大寮區鳳林二路876號,54e0cc8e-9310-4b83-a0fb-333ad38a10d1
台灣默克股份有限公司台北市內湖區堤頂大道2段89號6樓,54e0c498-ce6c-45a0-b4c2-3fe5d38a10d1
台灣龍角散有限公司台北市信義區基隆路2段51號14樓,54e0c4a7-6368-4428-bc98-3fe5d38a10d1
台田藥品股份有限公司臺北市松山區南京東路5段108號11樓,54e0c498-1b04-4d63-8ab1-3fe5d38a10d1
台耀化學股份有限公司桃園縣蘆竹市和平街36號,54e0c499-81a8-45e1-b15c-3fe5d38a10d1
台耀化學股份有限公司蘆竹廠桃園縣蘆竹鄉坑口村和平街36、36-1號,54e0c499-87e8-4b0b-b325-3fe5d38a10d1
台聯藥物有限公司台北市中山區南京西路一號6樓601室,54e0c4a0-b134-472b-b214-3fe5d38a10d1
台裕化學製藥廠股份有限公司新竹縣竹東鎮員山路11巷13弄1號,54e0c498-031c-4c4a-ac7f-3fe5d38a10d1
台馬發展有限公司雲林縣虎尾鎮下湳五四號,54e0cc8e-e8a4-4f5f-a125-333ad38a10d1
合一藥品企業股份有限公司台南市東區東寧路４６２號,54e0cc91-5c30-4be3-a004-333ad38a10d1
合寧貿易有限公司台北巿雙連街５４號２樓,54e0c4a0-6e14-4f3f-8516-3fe5d38a10d1
合強藥業股份有限公司新北市三重區福隆路3號1樓,54e0cc95-32ec-4472-89c7-333ad38a10d1
合成藥品股份有限公司高雄巿新興區洛陽街１１號５樓之６,54e0c497-7e30-4bb3-b57b-3fe5d38a10d1
合縱股份有限公司台北巿中山區新生北路二段３１之一號１１樓之７,54e0c4a3-5960-4bab-b386-3fe5d38a10d1
合誠化學製藥股份有限公司桃園縣平鎮工業區工業十路１５號,54e0c497-3f18-4b93-8154-3fe5d38a10d1
合誠化學製藥股份有限公司台北分公司新北市汐止區大同路一段147號9樓,54e0c499-0ea0-42b0-bc53-3fe5d38a10d1
吉原貿易股份有限公司台北巿永綏路５號,54e0c498-587c-458c-af58-3fe5d38a10d1
吉地喜股份有限公司新竹縣新豐鄉新豐村紅毛23之5號,54e0c49a-8f84-42a9-807f-3fe5d38a10d1
吉如有限公司台北巿新生南路一段５０之２號４樓,54e0c498-86f0-4a98-b6e2-3fe5d38a10d1
吉宮貿易有限公司台北巿合江街１３０巷１８號３樓,54e0c4a3-2650-49b8-804f-3fe5d38a10d1
吉富貿易有限公司台北市內湖區行愛路77巷69號7樓,54e0c498-b7c8-4279-ac7c-3fe5d38a10d1
吉帝藥品股份有限公司台中市北屯區綏遠路二段216之5號6樓,54e0c498-10e4-4275-9f25-3fe5d38a10d1
吉林行股份有限公司台北巿安和路８７巷１５號地下樓,54e0c4a3-b7a8-4bd4-894f-3fe5d38a10d1
吉泰藥品股份有限公司台北市大安區敦化南路2段128號15樓之6,54e0c498-b234-4257-aca3-3fe5d38a10d1
吉泰貿易有限公司台北巿重慶南路一段５巷４之２號,54e0c4a1-4104-4f2b-9816-3fe5d38a10d1
吉發企業股份有限公司台北巿愛國西路９號２Ｆ之９,54e0c498-a148-4247-a08e-3fe5d38a10d1
吉立製藥股份有限公司彰化縣永靖鄉永興村九分路３０７巷１號,54e0cc8e-6aa8-4e4e-80f5-333ad38a10d1
吉胃達藥業股份有限公司台北市松山區富錦街116號,54e0c4a5-8624-4e99-890c-3fe5d38a10d1
吉裕藥品有限公司台南市凱旋路２５４號,54e0c498-f244-412a-bece-3fe5d38a10d1
吉隆貿易股份有限公司台北巿濟南路一段１５號１２Ｆ,54e0c4a0-3d48-4b47-b3bc-3fe5d38a10d1
吉霖股份有限公司台北巿中正區南昌路二段１０３號７樓之３,54e0c498-f700-4bd5-b703-3fe5d38a10d1
吉靈企業有限公司台北巿新生北路二段１１５巷５１號,54e0c4a1-7838-4a44-a6f9-3fe5d38a10d1
同仁堂台灣藥店台中市北區尚德街91巷6號1樓,54e0cc8e-9488-4582-8ad3-333ad38a10d1
同南製藥股份有限公司新竹縣湖口鄉民族街５４號,54e0c49a-b684-4438-b898-3fe5d38a10d1
同盛藥品股份有限公司台北巿南京西路３０號之１,54e0c4a1-774c-4c36-b447-3fe5d38a10d1
名品生技開發有限公司新北市永和區勵行街１１９號１樓,54e0cc97-b2f4-4950-b578-333ad38a10d1
名賜貿易有限公司台中巿中區中山路９６號２樓,54e0c4a3-9404-4458-8ff7-3fe5d38a10d1
向天貿易有限公司臺北市中山區中山北路二段79號10樓,54e0c49e-ddfc-403e-9f4c-3fe5d38a10d1
吳氏泰吉藥品有限公司台南巿光明街１４７號之１０,54e0c49b-321c-4a20-aee8-3fe5d38a10d1
呂仙祖中藥行高雄市鳳山區鳳松路3-7號,54e0cc93-e134-4125-b6fc-333ad38a10d1
呈春貿易股份有限公司台北巿忠孝東路４段２８５號６樓之１,54e0c4a1-e628-48da-a1c5-3fe5d38a10d1
和光西藥行台中巿復興路三段１０９號,54e0c498-3718-4587-b4c5-3fe5d38a10d1
和利貿易有限公司台南巿民權路２７號,54e0c4a1-2770-4ee3-8779-3fe5d38a10d1
和新貿易有限公司台北巿臨沂街２７巷８號,54e0c49a-d704-4e12-94da-3fe5d38a10d1
和標萬塔油膏企業行高雄市三民區澄和路99號2樓,54e0cc93-dc4c-4c32-be4c-333ad38a10d1
和氣藥品股份有限公司嘉義市東區東川里大雅路2段578巷30號1樓,54e0cc8f-f904-4dac-8ce8-333ad38a10d1
和生王貿易股份有限公司台南巿忠義路二段８５號,54e0c498-8f48-4cea-b144-3fe5d38a10d1
和盛記蔘藥有限公司高雄市鹽埕區富野路67之1號1樓,54e0cc90-39b4-4de7-86ad-333ad38a10d1
和聯生技藥業股份有限公司台北市敦化北路３１１號５樓,54e0c49f-9b3c-4ece-ab49-3fe5d38a10d1
和聯藥業股份有限公司台北巿敦化北路３１１號５樓,54e0c4a1-78f4-461a-a656-3fe5d38a10d1
和鑫藥品行高雄巿三民區熱河一街９號,54e0c49b-ddbc-4ca9-904e-3fe5d38a10d1
品庠醫藥生技股份有限公司臺北市內湖區基湖路35巷51號7樓,54e0c498-e684-4f8a-a4c1-3fe5d38a10d1
哲雲行實業有限公司高雄巿三民區重慶街１１７號,54e0c4a4-30a8-4bf4-989a-3fe5d38a10d1
唐鑫有限公司台中市西屯區福雅路143號4樓之2,54e0c498-fe14-48fb-bbe5-3fe5d38a10d1
商登貿易有限公司台北縣中和市連城路258號12樓之4,54e0c4a5-a1d4-409c-9247-3fe5d38a10d1
商鶴藥品有限公司台北市中山區南京東路2段206號7樓,54e0c499-7dc4-426f-8dc6-3fe5d38a10d1
啟和貿易有限公司台北市迪化街一段94號3樓,54e0cc8e-8778-4e50-a61a-333ad38a10d1
啟方企業有限公司台南市永康區埔園里中正路140號,54e0cc92-3b9c-43fa-b7df-333ad38a10d1
啟發股份有限公司台北巿新生北路二段３３巷８號,54e0c4a5-704c-4be2-a18e-3fe5d38a10d1
啟興貿易行有限公司台北巿光復南路２６０巷３９之２號,54e0c4a0-9434-4e48-968c-3fe5d38a10d1
啟裕藥品有限公司台北巿臥龍街１７７巷１７號,54e0c4a0-1f68-4712-b53d-3fe5d38a10d1
喬元中藥行台中市西屯區櫻花路七十號一樓,54e0cc95-b480-4e18-bd32-333ad38a10d1
喬領企業有限公司台中市西屯區朝馬一街32號1樓,54e0c49a-3dec-4f6c-a3fd-3fe5d38a10d1
嘉信藥品股份有限公司嘉義巿劉厝里１號,54e0c49a-ef54-43b4-a9d0-3fe5d38a10d1
嘉億企業股份有限公司高雄市烏松區?埔村大同路５之１號,54e0c4a0-7ec0-4613-b687-3fe5d38a10d1
嘉南氣體工業股份有限公司嘉義縣太保市嘉太工業區興業路5號,54e0c4a0-c640-405e-9211-3fe5d38a10d1
嘉原企業股份有限公司台中巿大慶街一段１５巷５號,54e0c49a-fa08-403f-bf5e-3fe5d38a10d1
嘉宏藥品生技有限公司新北市汐止區建成路23巷18號,54e0cc93-fe60-4216-b7ba-333ad38a10d1
嘉德藥品企業有限公司台北巿富錦街４８５號,54e0c4a0-7bd4-4746-9f74-3fe5d38a10d1
嘉德藥品企業股份有限公司台北市中山區民生東路二段176號5樓,54e0c4a1-8058-4347-890a-3fe5d38a10d1
嘉成藥品股份有限公司台北巿忠孝東路三段１８０號２樓,54e0c4a1-7224-404a-bca1-3fe5d38a10d1
嘉星製藥廠股份有限公司嘉義巿中正路５５２巷１號,54e0c497-5550-4a40-926b-3fe5d38a10d1
嘉林藥品有限公司台北市士林區通河東街1段110號,54e0c49b-367c-4eaa-88b4-3fe5d38a10d1
嘉華生技醫藥有限公司台北市中正區金華街55號1樓,54e0c49b-c684-49a1-a03b-3fe5d38a10d1
四泰貿易股份有限公司台北縣新店巿順安街６２號,54e0c498-a6d4-49e7-bb8d-3fe5d38a10d1
回元堂中藥房屏東縣屏東市高豐街２０號,54e0cc8e-2e90-4aed-915d-333ad38a10d1
回春堂製藥廠股份有限公司桃園縣新屋鄉社子村社子８號,54e0c498-d5a0-4ea5-b5ba-3fe5d38a10d1
回春堂製藥廠股份有限公司桃園廠桃園縣新屋鄉社子村社子８號,54e0c498-dc44-4de0-920c-3fe5d38a10d1
回生堂中藥房金門縣金城鎮莒光路1號,54e0cc92-7704-4911-ae8f-333ad38a10d1
回生藥業股份有限公司台北巿長沙街２段５６之１號６樓,54e0c499-dee0-4117-a75b-3fe5d38a10d1
因華生技製藥股份有限公司台北市內湖區瑞光路478巷20號9樓、22號9樓,54e0c49e-2014-49be-8e13-3fe5d38a10d1
國信藥品股份有限公司嘉義市南興路２２２號,54e0c498-c5ec-4f33-a42a-3fe5d38a10d1
國偉貿易有限公司台北市中山區松江路２９３號３樓３１１室,54e0c4a5-e5ec-489e-bc67-3fe5d38a10d1
國光生物科技股份有限公司台中市潭子區潭興路一段三號,54e0c498-91d8-4009-b1ac-3fe5d38a10d1
國協化工股份有限公司桃園縣新屋鄉永安村下莊子二三八之四號,54e0c49c-0404-40a7-afff-3fe5d38a10d1
國品藥品實業有限公司高雄市三民區鼎力里民族一路878號7樓之1,54e0cc8e-bf64-4ddf-bfec-333ad38a10d1
國嘉製藥工業股份有限公司台中縣大甲鎮日南里青年路１５５號,54e0c499-9f5c-4092-b4d9-3fe5d38a10d1
國嘉製藥工業股份有限公司二廠台中市大甲區幼獅工業區工二路３３號,54e0cc8f-4efc-4153-be92-333ad38a10d1
國嘉製藥工業股份有限公司幼獅三廠臺中市大甲區日南里工十路2號,54e0c498-827c-45d8-a75a-3fe5d38a10d1
國安生技股份有限公司高雄市新興區渤海街6號12樓之3,54e0c49b-bb34-4fa5-aa77-3fe5d38a10d1
國安藥品行高雄巿新興區林森一路１６３號２樓之４,54e0c49b-d370-4723-a230-3fe5d38a10d1
國安製藥股份有限公司新竹縣湖口鄉實踐路１４號,54e0cc8f-7d90-4b62-b5a8-333ad38a10d1
國安製藥股份有限公司新竹廠新竹縣湖口鄉實踐路１４號,54e0cc90-1ddc-4e08-a968-333ad38a10d1
國峰製藥生技股份有限公司高雄市苓雅區中山二路311號2樓,54e0cc90-ae58-41c5-8a94-333ad38a10d1
國峰製藥生技股份有限公司高雄廠高雄市彌陀區產業路產業路156號、156-1號,54e0cc8e-e754-4c9e-8886-333ad38a10d1
國強生技股份有限公司台南市安平工業區新忠路２０號,54e0c4a7-0c70-452a-897a-3fe5d38a10d1
國強藥品股份有限公司台南巿安平工業區新忠路２０號,54e0c499-d9c0-44d2-b212-3fe5d38a10d1
國強藥廠股份有限公司台南市安平工業區新忠路２０號,54e0c49a-0f68-441f-926d-3fe5d38a10d1
國本藥品股份有限公司高雄縣鳳山市建國路３段７０巷２弄１之３號,54e0c49a-4854-463a-ad75-3fe5d38a10d1
國本製藥工業股份有限公司高雄市大寮區鳳屏二路一二號,54e0cc90-9b00-4b65-8e6d-333ad38a10d1
國本製酒生技股份有限公司高雄市大寮區鳳屏二路一二號,54e0cc8e-1688-4b3a-89de-333ad38a10d1
國泰製藥有限公司基隆巿安樂區外？里基金一路３４號,54e0c498-5640-4b63-b6c8-3fe5d38a10d1
國瑞股份有限公司台北巿信義路三段１０６號８Ｆ,54e0c4a3-a96c-4cc9-96f8-3fe5d38a10d1
國科生技製藥股份有限公司桃園縣龍潭鄉三水村大北坑路５０號,54e0cc8e-158c-4bb0-b05d-333ad38a10d1
國科生物科技股份有限公司中壢市榮民路286巷25弄12號2樓,54e0cc8f-d31c-4cc1-a0fd-333ad38a10d1
國科生物科技股份有限公司龍潭廠桃園縣龍潭鄉三水村大北坑路５０號,54e0cc8e-0284-403e-833f-333ad38a10d1
國立清華大學原子科學研究所同位素組新竹市光復路二段１０１號,54e0c4a0-c858-402b-9160-3fe5d38a10d1
國華貿易股份有限公司台北巿新生南路一段１１６號２Ｆ,54e0c4a3-74b8-461d-a3eb-3fe5d38a10d1
國際威林生化科技股份有限公司臺北市中正區金山南路一段65號2樓,54e0c49f-b04c-4b88-94f7-3fe5d38a10d1
國際新藥工業股份有限公司新北市土城區清化村石門路４９之１號,54e0c498-4f3c-4ffe-b49b-3fe5d38a10d1
國韶實業有限公司高雄市左營區大中一路232號,54e0c498-2a24-46d3-bd60-3fe5d38a10d1
均益有限公司台北巿雙城街３２巷３號２樓,54e0c4a2-32f8-4dd8-a36f-3fe5d38a10d1
均記貿易有限公司台中市南區福新街二十三號,54e0cc90-b8d0-4dea-b547-333ad38a10d1
均隆有限公司台北巿南京東路五段３３１號,54e0c497-9474-4fe1-b987-3fe5d38a10d1
坤億生技有限公司高雄市左營區菜公里文強路52號,54e0c49f-af80-4972-91e8-3fe5d38a10d1
坤益中藥行高雄市三民區正忠路200巷9號,54e0cc90-0aa0-4ddc-bea5-333ad38a10d1
坦麗亞實業股份有限公司台北巿忠孝東路一段１５２號８樓,54e0c4a2-1708-4930-8ef9-3fe5d38a10d1
垂欣企業股份有限公司台北市永吉路２００巷２１弄２６號４Ｆ,54e0c4a3-6ae0-4b42-8465-3fe5d38a10d1
培力藥品工業股份有限公司台中巿工業區六路１１號,54e0c498-1914-474d-b47e-3fe5d38a10d1
增瑞實業有限公司台北巿北投區實踐街８８－１號３樓,54e0c4a2-96fc-4738-ab04-3fe5d38a10d1
士宣生技股份有限公司新北市新莊區後港一路141號1樓及143號1樓,54edefd9-5224-44a0-ae9f-4939d38a10d1
士林藥品企業股份有限公司台北巿忠孝東路四段２８５號６Ｆ之１,54e0c499-8bd4-42a5-b6bb-3fe5d38a10d1
壯生醫療器材股份有限公司臺北市大安區敦化南路二段319號6樓,54e0c49a-34f4-48c3-aa1f-3fe5d38a10d1
壽元化學工業股份有限公司嘉義市西區新民路128號,54e0c498-ca9c-4d88-a9b6-3fe5d38a10d1
壽元化學工業股份有限公司湖內廠嘉義巿新民路１２８號,54e0c498-4ecc-4d77-a747-3fe5d38a10d1
壽山生物科技製藥廠彰化縣鹿港鎮工業西一路26號,54e0cc8e-92d8-465c-ac6f-333ad38a10d1
壽山製藥廠彰化縣田中鎮員集路二段172號,54e0cc8e-5e38-41dc-b416-333ad38a10d1
多富貿易有限公司嘉義縣朴子市大鄉里槺榔253之59號,54e0cc8e-2348-4ac2-9722-333ad38a10d1
多棣實業有限公司台北巿林森北路４１３號８樓之１８,54e0c4a4-6370-4005-9fdd-3fe5d38a10d1
大世界製藥廠台南市東豐路二二七巷四號,54e0cc8e-f784-4e38-90af-333ad38a10d1
大中有限公司台北巿瑞安街２５４號４樓,54e0c499-221c-4a8a-a45d-3fe5d38a10d1
大中有限公司製藥廠新北市三重區仁政街四三號,54e0cc90-d330-49b0-9f0b-333ad38a10d1
大亞藥品工業股份有限公司桃園縣蘆竹鄉海湖村五鄰海山路二段４２８號,54e0c49a-c110-4a29-904d-3fe5d38a10d1
大享藥品有限公司臺北縣新店巿中央五街８３號,54e0c4a5-c180-4b82-b973-3fe5d38a10d1
大全榮製藥股份有限公司高雄巿三民區建國二路３１號,54e0c498-4214-4f8b-a6e9-3fe5d38a10d1
大勝貿易股份有限公司台北巿松江路１８２號１０樓,54e0c4a0-a91c-458a-9019-3fe5d38a10d1
大同化學製藥廠股份有限公司台北縣永和巿永和路一段４５號,54e0c498-72cc-4ed7-a2e4-3fe5d38a10d1
大同安藥業股份有限公司桃園縣中壢巿龍岡路一段１４８巷１０號,54e0c498-6a34-418f-87d9-3fe5d38a10d1
大啟藥品有限公司新北市永和區中正路602巷1號11樓之5,54e0c4a4-6d90-4321-847c-3fe5d38a10d1
大城興業股份有限公司台北巿中山區民權東路一段７０巷７號１樓,54e0c49f-9958-41a4-b113-3fe5d38a10d1
大安化學製藥股份有限公司台南市北區勝利路473號,54e0c498-1d78-46e0-bbe7-3fe5d38a10d1
大寬藥品股份有限公司台中市南屯區向學路56號,54e0c49c-5970-43c2-b8e3-3fe5d38a10d1
大川蔘藥行台中市北屯區東山里橫坑巷二十七之四十二號一樓,54e0cc91-0074-4e03-b7c2-333ad38a10d1
大志貿易有限公司台北巿信義路四段３９８號之１二樓,54e0c499-f0f0-490b-94cc-3fe5d38a10d1
大昌生物科技有限公司高雄市三民區新民路116號,54e0cc96-2d88-40a9-a403-333ad38a10d1
大昌製藥廠台南縣佳里鎮佳里興３０５號,54e0cc8e-4e48-4a71-a61b-333ad38a10d1
大明化學製藥股份有限公司彰化縣秀水鄉安溪村彰水路４３之１號,54e0c498-12d0-42d1-a917-3fe5d38a10d1
大明產業股份有限公司台北市大同區長安西路一○六號四樓之三,54e0c498-2068-451b-a461-3fe5d38a10d1
大明製藥廠嘉義縣竹崎鄉紫雲村坑口15-1號,54e0cc8f-b58c-4f61-96ca-333ad38a10d1
大昭製藥生物科技股份有限公司台南市官田區建業路7號,54e0cc8e-9bb4-4c76-abaf-333ad38a10d1
大有企業股份有限公司台北巿懷寧街４３號,54e0c498-3688-4b11-9999-3fe5d38a10d1
大東亞貿易有限公司台北巿民生東路２段１７４號２樓,54e0c498-01c0-4229-9392-3fe5d38a10d1
大林製藥廠股份有限公司新竹縣竹東鎮大林路５號,54e0c49b-7ab0-4d96-9a21-3fe5d38a10d1
大楠有限公司台北市長安東路一段４３巷４號１樓,54e0c49e-c588-4185-9a94-3fe5d38a10d1
大模貿易有限公司新北市三重區自強路4段31巷8號1樓,54e0c499-4c18-475e-ab99-3fe5d38a10d1
大正貿易有限公司台北市中山區四平街18號2樓,54e0c4a3-e8ac-4a5c-98fa-3fe5d38a10d1
大法貿易有限公司台北巿敦化南路一段１７９號１３樓,54e0cc90-dd9c-44d7-9546-333ad38a10d1
大源氣體股份有限公司二廠苗栗縣頭屋鄉頭屋村23鄰雙龍街92號,54e0c4a0-e140-43e2-a550-3fe5d38a10d1
大濟製藥廠股份有限公司台中市大甲區工三路16號,54e0cc8e-be84-4e5a-8ba5-333ad38a10d1
大用股份有限公司台北巿松山區南京東路五段356號13樓之1,54e0c4a4-1fdc-4f6a-a27f-3fe5d38a10d1
大田藥品有限公司台中市大里區大明路241號1樓,54e0c4a6-85c4-419c-823b-3fe5d38a10d1
大田製藥廠西藥部台南市萬鐘里中山路八四號,54e0cc8e-3438-47c6-84f1-333ad38a10d1
大申貿易有限公司台北巿康定路２４２號,54e0c4a1-e020-4750-8d65-3fe5d38a10d1
大眾行有限公司台北巿襄陽路６號１１樓,54e0c499-a4b4-42d9-a71f-3fe5d38a10d1
大祥企業行台北巿忠孝東路三段２５１巷５弄１０－１號,54e0c4a1-4718-40f7-b969-3fe5d38a10d1
大秀貿易有限公司台北巿衡陽路１６號,54e0c499-9dfc-484f-b375-3fe5d38a10d1
大統貿易股份有限公司台北巿南京東路五段１８８號６樓,54e0c498-d5d8-4dc2-8513-3fe5d38a10d1
大維化學製藥股份有限公司台南市永康區鹽洲村洲工街１７５巷１號１樓,54e0cc8e-e1b4-4928-9f65-333ad38a10d1
大維生化製藥國際有限公司台南市永康區鹽洲里洲工街175巷10號,54e0cc8e-ff3c-45c2-a0fa-333ad38a10d1
大維生化製藥國際股份有限公司台南市永康區鹽洲里洲工街175巷10號,54e0cc91-44f0-45ad-b788-333ad38a10d1
大維藥品股份有限公司台南市永康區鹽洲村洲工街１７５巷１號１樓,54e0cc94-a85c-43d2-9f0d-333ad38a10d1
大英企業股份有限公司台北巿濟南路三段６３號５Ｆ,54e0c4a0-cfc8-484e-9df0-3fe5d38a10d1
大茂中藥房屏東縣屏東市民族路281之1號,54e0cc8f-0f84-4a16-be12-333ad38a10d1
大茂製藥科技有限公司屏東市和生路３段６７８號,54e0cc8e-1074-46da-8e7e-333ad38a10d1
大裕生技興業有限公司台中市西屯區府會園道179號19樓,54e0c498-03ac-4556-93bd-3fe5d38a10d1
大裕藥業股份有限公司台中巿西區民權路２１９號１３樓,54e0c49e-7748-4269-b7e6-3fe5d38a10d1
大豐膠囊工業股份有限公司台中市潭子區中山路三段２０３號,54e0c49c-1ebc-4501-83f1-3fe5d38a10d1
大豐製藥股份有限公司彰化巿延平里岸頭巷１１號,54e0c497-d874-468c-a218-3fe5d38a10d1
大赫產業股份有限公司台北巿敦化南路一段２３３巷３７號８樓,54e0c4a0-bf48-4cf7-8e21-3fe5d38a10d1
大通藥品有限公司台南市東區崇明里大同路二段７２１號１樓,54e0cc97-4a54-430f-aa9d-333ad38a10d1
大進貿易股份有限公司台北巿忠孝東路三段２８３號３、４、５樓,54e0c49a-df70-4656-a599-3fe5d38a10d1
大陞股份有限公司台北巿永康街７５巷１４－１號２樓,54e0c4a0-8870-4280-b506-3fe5d38a10d1
大陳企業有限公司台北巿塔城街６４號３樓,54e0c4a1-c978-40fa-9bea-3fe5d38a10d1
大陽製藥股份有限公司台北市中正區重慶南路一段121號5樓之17,54e0c498-9d54-4ccc-a551-3fe5d38a10d1
大順藥品社台北巿木柵路一段３０２號,54e0c49a-cb88-47d9-b7ab-3fe5d38a10d1
大鵰生技股份有限公司屏東縣長治鄉研發一路2號,54e0cc90-552c-4175-b0d8-333ad38a10d1
天一藥廠股份有限公司台南市官田區二鎮村工業路三一號,54e0cc8e-f4bc-462b-b2a5-333ad38a10d1
天上果企業社高雄市三民區大順二路七二五之一號十五F,54e0cc8f-0058-4c35-8e2b-333ad38a10d1
天下生物科技股份有限公司臺中市大甲區工九路9號,54e0c498-d114-452a-a488-3fe5d38a10d1
天乾企業有限公司台南巿海佃路三段２１５號,54e0c499-6c8c-47ca-973b-3fe5d38a10d1
天乾製藥有限公司台南市將軍區忠興村１３２之３５號,54e0cc8f-fa4c-4ed8-995e-333ad38a10d1
天乾製藥股份有限公司台南市將軍區忠興村132之35號,54e0cc90-1abc-4f4e-bf02-333ad38a10d1
天仁川業股份有限公司台南巿裕農路２８８巷１１０弄６號,54e0c499-5258-42e1-93c0-3fe5d38a10d1
天仁生化工業股份有限公司台南市裕農路２８８巷１１０弄６號,54e0c499-6e78-4dcb-af7c-3fe5d38a10d1
天保生物科技股份有限公司台南市北區文成三路78號1樓,54e0cc8e-49ec-4c81-9725-333ad38a10d1
天保製藥股份有限公司高雄市鼓山區鼓山一路一六一巷六一號,54e0cc8e-98e4-4683-a9ac-333ad38a10d1
天地人國際有限公司高雄市三民區自立一路一九八號,54e0cc8f-2b50-4f02-9d5f-333ad38a10d1
天擎生化科技股份有限公司台北市信義區基隆路二段131之3號3樓,54e0c4a0-89a4-460a-919e-3fe5d38a10d1
天明製藥股份有限公司高雄市仁武區仁心路197號,54e0cc8e-7b9c-441a-a406-333ad38a10d1
天明製藥股份有限公司農科分公司屏東縣長治鄉德和村神農路3號,54e0cc8e-2878-4bb6-b082-333ad38a10d1
天澤貿易股份有限公司台北市新生北路２段１３３巷１號７樓,54e0c4a0-2b78-41db-ab55-3fe5d38a10d1
天理生物科技有限公司台中市外埔區水美村水美路１４７號,54e0cc8f-28fc-43c5-ad54-333ad38a10d1
天生堂藥品股份有限公司高雄市前金區五福三路54號6樓之2,54e0c498-f184-4205-a8c5-3fe5d38a10d1
天生堂藥局台北巿新生南路一段１５７巷２１之２號１Ｆ,54e0c4a0-da1c-471b-9818-3fe5d38a10d1
