"ROQUETTE FRERES62136 LESTREM, FRANCE62136 LESTREM, FRANCE",54edefe5-f238-45f5-9955-4939d38a10d1
"RORER HEALTH CARE LIMITEDST. LEONARDS HOUSE ST. LEONARDS ROAD EASTBOURNE EAST SUSSEX BN21 3YG",54edefd9-4d38-4526-a21c-4939d38a10d1
"RORER JAPAN INCORPORATION.827-7 SHINKANAYA KAMIYAMA-SHI YAMAGATA.",54edefe2-0f88-4dca-b2b6-4939d38a10d1
"RORER PHARMACEUTICAL CORPORATION500 VIRGINIA DRIVE FORT WASHINGTON PENNSYLVANIA",54edefe1-d6bc-4af4-88c7-4939d38a10d1
"RORER PHARMACEUTICALS. LTD.HAMPDEN PARK EASTBOURNE, EAST SUSSEX BN22 9AG",54edefe5-efb8-468d-b92c-4939d38a10d1
"RORER, S.A. LABORATORIOSSAN RAFAEL 3-28100 ALCOBENDAS MADRID",54edefe8-9468-4001-a672-4939d38a10d1
"ROTER DIVISION OF CROOKES HEALTHCARE B.V.ARENDSTRAAT 3,1223RE, HILVERSUM",54edefe5-2d30-436b-bfc5-4939d38a10d1
"ROTEXMEDICA GMBHBUNSENSTRABE 4, D-22946 TRITTAU GERMANY",54edefe2-b688-46e2-89e5-4939d38a10d1
"ROTEXMEDICA GMBH KORNERSTRASSE34 2000 HAMBURG 60 P.O.BOX 60220",54edefe5-2760-4774-8d21-4939d38a10d1
"ROTEXPHARMA GMBHKORNERSTRASSE 34 2 HAMBURG 60",54edefe1-4884-4c7a-95dd-4939d38a10d1
"ROTTA & C.S.P.A.MILANO.",54edefdb-78cc-4d0e-8611-4939d38a10d1
"ROTTA RESEARCH LABORATORIUM S.P.A.VIA VALOSA DI SOPRA,9 20052 MONZA (MILANO) ITALY",54edefda-6918-446a-bef3-4939d38a10d1
"ROTTAPHARM LTD.DAMASTOWN INDUSTRIAL PARK, MULHUDDART, DUBLIN 15, IRELAND",54edefe6-93d8-4a8d-9f54-4939d38a10d1
"ROTTAPHARM S.P.A.VIA VALOSA DI SOPRA,9 20052 MONZA (MILANO) ITALY",54edefe6-cbb4-4efb-8056-4939d38a10d1
"ROTTENDORF PHARMA GMBHOSTENFELDER STRASSE 51-61, D-59320 ENNIGERLOH, GERMANY",54edefe8-f10c-416e-9ee6-4939d38a10d1
"ROUGIER8480 SAINT-LAURENT MONTREAL 351",54edefe2-456c-4a83-924e-4939d38a10d1
"ROUGIER INC/DESBERGERS LTD/NADEAN LAB. LTD.1000 INDUSTRIAL BLVD, CHAMBLY, QUEBEC",54edefe8-21d8-47b8-91f0-4939d38a10d1
"ROUSSEL LAB. LTD.SWINDON IN WILTSHIRE",54edefe1-3e60-4102-bde5-4939d38a10d1
"ROUSSEL MORISHITA CO,LTD.1658, OSHINOHARA,YASU-CHO,YASU-GUN,SHIGA,JAPAN.",54edefd9-d610-492f-8eff-4939d38a10d1
"ROUSSEL UCLAFTOUR ROUSSEL NOBEL CEDEX NO. 3 92080 PARIS,LA DEFENSE",54edefd9-673c-4259-ae89-4939d38a10d1
"ROUSSEL UCLAF SOCIETE APPLICATIONS SCIENTIFIC AND MEDICALS LABORATORIES I.S.H.15,RUE OLIVIER-METRA 75980 PARIS CEDEX 20",54edefe2-7dd4-4cb4-a5c0-4939d38a10d1
"ROVETO S.A.VIA CORTIVALLO 22 6903 LUGANO",54edefe2-ead4-492f-858f-4939d38a10d1
"ROWA PHARMACEUTICALS LTD.BANTRY CO-CORK",54edefe4-dda8-425c-828d-4939d38a10d1
"ROWA-WAGNER KG ARZNEIMITTEL-FABRIKFRANKENFORSTER STR. 77 D-5060 BERGISCH GLADBACH 1",54edefe6-248c-490b-bef6-4939d38a10d1
"RPG LIFE SCIENCES LIMITED25, MIDC LAND, THANE-BELAPUR ROAD, NEW BOMBAY 400 705 INDIA",54edefe8-6678-4099-a631-4939d38a10d1
"RUTARA GMBHHEIDELBERG",54edefd9-ae54-45aa-ad26-4939d38a10d1
"RUTGERSWERKE A.G.MAINZER LANDSTRASSE 217 6000 FRANKFURT /MAIN 1",54edefe2-6d54-483a-ab1f-4939d38a10d1
"RYUKAKUSAN CO. LTD.5-12 HIGASHI-KANDA, 2-CHOME CHIYODA-KU TOKYO",54edefe3-fc14-4868-88c6-4939d38a10d1
"RYUKAKUSAN CO., LTD. CHIBA FACTORY1460-3, MITODAI, MITOAZA, TAKO-MACHI, KATORI-GUN, CHIBA, 289-2247, JAPAN",54edefe4-b804-487c-889a-4939d38a10d1
"S-P CANADA3535 TRANS-CANADA HIGHWAY POINTE CLAIRE QUEBEC CANADA H9R 1B4",54edefe5-6cf8-428e-94ba-4939d38a10d1
"S. A. OMNICHEM.B-9200 WETTEREN COOPALLOAN 91",54edefe6-5528-48cd-8d43-4939d38a10d1
"S. C. SINDAN-PHARMA S.R.L.11 ION MIHALACHE BLVD., SECTOR 1, 011171, BUCHAREST, ROMANIA",54edefda-72f8-4c2e-aba5-4939d38a10d1
"S. KANT HEALTHCARE LIMITEDPLOT NO. 1802-1805, G.I.D.C. PHASE III, VAPI-396195, DISTRICT: VALSAD, GUJARAT STATE, INDIA",54edefea-5010-4916-adfc-4939d38a10d1
"S. S. PHARMACEUTICAL CO., LTD. (NARITA PLANT)NO. 1143, NANPEIDAI, NARITA-SHI, CHIBA-PREFECTURE12-4,2-CHOME,HAMACHO,NIHONBASHI,CHUO-KU,TOKYO,JAPAN",54edefe3-ae78-4add-8d1d-4939d38a10d1
"S.A. ALCON-COUVREUR N.V.RIJKSWEG 14, 2870 PUURS, BELGIUM",54edefd8-ab5c-4303-b7d1-4939d38a10d1
"S.A. FARMACEUTICI ITALIALARGO GUIDO DONEGANI 1-2 MILANO",54edefda-5fe8-4207-925b-4939d38a10d1
"S.A. LABAZ. N.V.-BELGIUMI. AVENUE DE BEJAR 1120 BRUSSELS",54edefe6-4488-45a6-80ee-4939d38a10d1
"S.A. LABORATIRES SAN-DERS-PROBEL.47-51 RUE HENRI WAFEL-AERTSSTRAAT  BRUXELLES 1060 BRUSSEL.",54edefe5-f1f0-446b-bc87-4939d38a10d1
"S.A. PHARMACHEMIC N.V.TERBEKEHOFDREEF 41, 2610 WILRIJK, ANTWERPEN",54edefd9-2a0c-40d9-ae93-4939d38a10d1
"S.A. RORER N.V.RUE DES PALAIS 112 BRUXELLES 1210 BRUSSEL BELGIUM",54edefe2-1b94-4d46-8626-4939d38a10d1
"S.A. WILL-PHARMA.AVENUE MONPLAISIRLAAN 33 1030 BRUXELLES-BRUSSEL",54edefe8-5948-4f35-a529-4939d38a10d1
"S.B. PENICK & CO. DIVISION OF CORN PRODUCT CO100 CHURCH ST. NEW YORK N.Y. 10007",54edefe6-26b0-4b3e-8aff-4939d38a10d1
"S.C. EUROPHARM S.A.2 PANSELELOR ST., BRASOV,500419, ROMANIA",54edefe6-43ac-46dc-8c65-4939d38a10d1
"S.C.A.T. LABORATORIES468 CHEMIN DU LITTORAL 13016 MARSEILLE",54edefe3-80c0-491a-ad1b-4939d38a10d1
"S.C.A.T.,18, A, 22, RUE D'ARRAS 92003 NANTERRE CEDEX",54edefe3-4f60-4a2f-a622-4939d38a10d1
"S.I.F.I. SPA (SOCIETA INDUSTRIA FARMACEUTICA ITALIANA JOINT STOOT COMPANY)",54edefda-0bcc-4b1f-9917-4939d38a10d1
"S.I.M.S.LOCALITA FILARONE,50066 REGGELLO (FLORENCE) ITALY.VIA DANTE DA CASTIGLIONE NO.8 FIRENZE ITALY.",54edefd9-de18-448f-9851-4939d38a10d1
"S.I.M.S.-SOCIETA ITALIANA MEDICINALI SCANDICCI S.R.L.LOCALITA FILARONE, 50066 REGGELLO, ITALY",54edefea-1ba0-4f3a-b81c-4939d38a10d1
"S.N.I.F.F. ITALIA S.P.A.VIA DELLA CARBONERIA 30/32-06073 SOLOMEO DI CORCIANO PERUGIA-ITALY",54edefe9-3ad0-424d-a74a-4939d38a10d1
"S.P.A. LABORATORI DELALANDE ISNARDI.VIA XXV APRILE, 69R. IMPERIA-ONEGLIA",54edefe3-6b64-4ebb-8ff2-4939d38a10d1
"S.S. PHARMACEUTICAL CO., LTD.NO. 1143, NANPEIDAI, NARITA CITY, CHIBA-PREFECTURE,JAPAN",54edefe9-1de8-4a87-8a01-4939d38a10d1
"S.S. PHARMACHEMK-44, MIDC, TARAPUR, BOISAR, DIST, THANE, 401 506 INDIA",54edefe8-bbe8-4600-9c5c-4939d38a10d1
"S.S.S. COMPANY71 UNIVERSITY AVE. S.W.ATLANTA GA 30302.",54edefe5-84f4-424b-8317-4939d38a10d1
"SACHTLEBEN CHEMIE GMBH4100 DUISBURG 17 HAMBURG",54edefe3-a7b4-4aae-b1a5-4939d38a10d1
"SAGA PHARMACEUTICAL CO., LTD.NO.481 KOKURA,OAZA,KIYAMA-MACHI,MIYAKI-GUN,SAGAKEN,JAPAN",54edefe7-b31c-492e-a930-4939d38a10d1
"SAGA SEIYAKU PHARMACEUTICAL CO. LTD.481 KOKURA KIYAMA-TOWN SAGA-PREFECTURE",54edefe3-b430-4356-b7fe-4939d38a10d1
"SAGAMI CHEMICAL INDUSTRY CO,. LTD.ASAHIMACHI 3-3-15 MACHIDA CITY TOHYO JAPAN",54edefdb-9ff8-4225-86dc-4939d38a10d1
"SAISHUNKA PHARM.CO. LTD.OKADA-MACHI, KUMAMOTO",54edefe2-9730-4a63-94fc-4939d38a10d1
"SAIWAI PHARMACEUTICAL CO., LTD.4-25, AKAGAWA 1 CHOME, ASAHI-KU, OSAKA",54edefe7-46a8-43a3-a226-4939d38a10d1
"SAKAI CHEMICAL & INDUSTRY CO. LTD.1-1330 MATSUGAOKA, NAKAMACHI, KAWACHINAGANO, OSAKA, JAPAN.1-1-23, EBISUNOCHO-NISHI, SAKAI, OSAKA, JAPAN.",54edefe1-2c60-4eea-9b84-4939d38a10d1
"SALINEN AUSTRIA AGSTEINKOGELSTRASSE 30A-4802 EBENSEE",54edefe2-1bbc-437d-84ca-4939d38a10d1
"SALUS RESEARCHES SARM S.P.A.VIA TIBURTINA, 1496-KM 15 ROMA",54edefe3-cd70-49a3-a907-4939d38a10d1
"SALUTAS PHARMA GMBHOTTO-VON-GUERICKE-ALLEE 1 39179 BARLEBEN GERMANY",54edefd9-7614-429e-a1a1-4939d38a10d1
"SALUTAS PHARMA GMBH, OSTERWEDDINGEN PLANTLange Gohren 3, D-39171 Sulzetal, Osterweddingen, Federal Republic of Germany",54edefe8-99e4-42e7-8b37-4939d38a10d1
"SALVIA-WERK GMBHD-6650 HAMBURG-SEAR",54edefe4-6024-4bdb-993f-4939d38a10d1
"SAM SUNG PHARM. IND. CO., LTD.199-6, MOJIC-DONG, SUNG DONG-GU, SEOUL, 133",54edefe6-07b8-49c5-ad0f-4939d38a10d1
"SAMIL PHAR. CO. LTD.B11-6 BANWOL INDUSTRIAL AREA, 772-1 WONSI-DONG, ANSAN-SI, KYUNGGI-DO, KOREA990-1,BANGBAE-DONG,SEOCHO-KU,SEOUL ,KOREA",54edefe4-4310-4a6d-bf72-4939d38a10d1
"SAMJIN PHARMACEUTICAL CO. LTD.904-2, SANGSIN-RI HYANGNAM-MYUN,HWASUNG-KUN, KYUNGKI-DO, KOREA.338-8,SEOKYO-DONG,MAPO-KU,SEOUL,KOREA",54edefe4-2f78-4948-b3d1-4939d38a10d1
"SAN-A PHARMACEUTICAL CO. LTD.3-13-6 SAGINOMIYA, NAKANO-KU TOKYO",54edefe2-ad18-489c-b444-4939d38a10d1
"SANABO GESSELLSCHAFT M. B. H.A-6250 KUNDL, TYROL",54edefe3-275c-4c50-9ec8-4939d38a10d1
"SANCARLO FARMACEUTICI 0004 SANTAPALOMBA ROME",54edefe2-90b8-4fa1-9d8c-4939d38a10d1
"SANDBERG & SCHNEIDEWINDHAMBURG",54edefd9-d62c-4692-9cba-4939d38a10d1
"SANDOZ GMBHBIOCHEMIESTRASSE 10, A-6250 KUNDL, AUSTRIA",54edefd9-7124-4d23-a260-4939d38a10d1
"SANDOZ GMBH  SCHAFTENAU PLANTBIOCHEMIESTRASSE 10, A-6336 LANGKAMPFEN, AUSTRIA",54edefd9-8aec-4b23-81de-4939d38a10d1
"SANDOZ GMBH SCHAFTENAU PLANTBIOCHEMIESTRASSE 10, A-6336 LANGKAMPFEN, AUSTRIA",54edefd9-e050-4161-b076-4939d38a10d1
"SANDOZ GMBH,  SCHAFTENAU PLANTBIOCHEMIESTRASSE 10, 6336 SCHAFTENAU/LANGKAMPFEN, AUSTRIA",54edefe7-4b80-409d-82bd-4939d38a10d1
"SANDOZ ILAC SANAYI VE TICARET A.S.GEPOSB, ATATURK BULVARI, CADDE N.1 9,  41400 GEBZE KOCAELI, TURKEY",54edefd9-d908-4e02-a4cc-4939d38a10d1
"SANDOZ ILACSANAYI VE TICARET A.S.GEBZE PLASTIKCILER, ORGANIZE SANAYI BOLGESI, ATATURK BULVARI 9. CADDE NO.1, 41400 GEBZE KOCAELI, TURKEY",54edefd9-f460-4290-b889-4939d38a10d1
"SANDOZ INDUSTRIAL PRODUCTS, S.A.Ctra. Granollers-Cardedeu C-250 (or C-251) Km 4 E-08520 Les Franqueses Del Valles-Barcelona-Spain",54edefe8-083c-4423-8a27-4939d38a10d1
"SANDOZ PHARMACEUTICALS AG6312 STEINHAUSEN, SWITZERLAND",54edefe9-4bc8-4bcf-a1c3-4939d38a10d1
"SANDOZ PHARMACEUTICALS GMBHRAIFFEISENSTRASSE 11, 83607 HOLZKIRCHEN, GERMANY",54edefe9-c500-41bb-8a74-4939d38a10d1
"SANDOZ PRIVATE LIMITEDPLOT NO. 8-A/2 & 8-B, TTC INDUSTRIAL AREA, KALWE BLOCK, VILLAGE-DIGHE, NAVI MUMBAI 400 708, INDIA",54edefda-9620-4e87-81af-4939d38a10d1
"SANDOZ S.A.CRAMER 4130, CIUDAD AUTONOMA DE BUENOS AIRES, ARGENTINA",54edefe8-49a4-47a2-99c1-4939d38a10d1
"SANDOZ SYNTEK ILAC HAMMADDELERI SAN. VE TIC. A.S.ISTANBUL DERI ORGANIZE SANAYI BOLGESI KAZLICESME CAD.NO:46 H-8 OZEL PARSEL 34956 TUZLA-ISTANBUL TURKEY",54edefe9-b41c-40fb-ac94-4939d38a10d1
"SANDS PHARMACEUTICALS575 HOOD ROAD, MARKHAM, ONTARIO, L3R 4E1, CANADA",54edefe1-30f0-4d37-a3d3-4939d38a10d1
"SANECA PHARMACEUTICALS A.S.NITRIANSKA 100, 920 27 HLOHOVEC, SLOVAK REPUBLIC",54edefd9-e048-450a-823b-4939d38a10d1
"SANG-A PHARM. CO. LTD.144-2 DEUNGCHON-DONG, KANGSEO-KU, SEOUL",54edefe3-e200-45be-a940-4939d38a10d1
"SANICO N.V.B 2300 TURNHOL BELGIUM",54edefe5-b9cc-486f-b20f-4939d38a10d1
"SANICO N.V. FOR PHARMACIA N.V./S.A.INDUSTRIEZONE 4 2300 TURNHOUT BELGIUM",54edefe7-cec8-475e-bc29-4939d38a10d1
"SANKO CHEMICAL INDUSTRIES LTD.9-19, 3-CHOME GIN-ZA, CHUO-KU. TOKYO.",54edefe2-e1a8-476a-ac93-4939d38a10d1
"SANKO PHARMACEUTICAL CO., LTD.2, 4-CHOME HONSEKI-CHO NIHONBASHI",54edefea-8e78-421d-8fc4-4939d38a10d1
"SANKO PHARMACEUTICAL IND. CO. LTD.4-2 HONGOKUCHO, NIHONBASHI CHUO-KU TOKYO.",54edefd8-5dbc-4a66-8d59-4939d38a10d1
"SANKO SEIGAKU KOGYO K.K.2, NIHONBASHI-HONGOKUCHO 4-CHOME, CHUO-KU TOKYO 103",54edefe2-e4cc-4580-828c-4939d38a10d1
"SANKYO CO. LTD.173,KOUNOUCHI,NAKAHARA-KAMIJU KU,HIRATSUKA-SHI,KANAGAWA JAPAN.",54edefd9-efd8-4028-aba4-4939d38a10d1
"SANKYO CO. LTD. (HIRATSUKA FACTORY)NO.1-12-1,SHINOMIYA,HIRATSUKA-SHI,KANAGAWA,JAPANNO.5-1 NIHONBASHI HONCHO 3-CHOME, CHUO-KU, TOKYO",54edefe7-be84-4031-a8bf-4939d38a10d1
"SANKYO CO. LTD. (SHINAGAWA FACTORY)2-58, HIROMACHI, 1-CHOME, SHINAGAWA-KU, TOKYO, JAPANNO.5-1, HONCHO 3-CHOME, NIHOBASHI, CHUO-KU, TOKYO, JAPAN",54edefe3-3b00-40de-bd84-4939d38a10d1
"SANKYO CO. LTD. {HIRATSUKA PLANT (MEGURO DIVISION)}NO. 18-16 MEGUROHONCHO-2 MEGURO-KU TOKYO JAPAN5-1 HONCHO 3-CHOME NIHONBASHI CHUO-KU TOKYO JAPAN",54edefe7-d42c-4218-8d78-4939d38a10d1
"SANKYO CO., LTD. (MISHIMA FACTORY)9-14, BUNKYOCHO 1-CHOME, MISHIMA-CITY, SHIZUOKA, JAPAN.5-1, HONCHO, 3-CHOME, NIHONBASHI, CHUO-KU, TOKYO, JAPAN.",54edefe8-6ac8-4854-a89e-4939d38a10d1
"SANKYO CO., LTD. (OSAKA FACTORY)9-63, NAGAEHIGASHI 2-CHOME, KITA-KU, OSAKA-SHI, OSAKA,JAPAN5-1,HONCHO, 3-CHOME, NIHONBASHI,CHUO-KU, TOKYO,JAPAN",54edefe4-32c0-4087-a98e-4939d38a10d1
"SANKYO PHARMA GMBHZIELSTATTSTRASSE 9, 81379 MUNCHEN, GERMANY",54edefd9-1fd0-4351-950d-4939d38a10d1
"SANKYO YELL YAKUHIN CO., LTD.4-4, 1-CHOME, HIRO-MACHI SHINAGAWA-KU TOKYO",54edefe1-4080-4825-b660-4939d38a10d1
"SANOFI AVENTISONE, ONSLOW STREET, GUILDFORD, SURREY GU1 4YS, UK",54edefe9-4a28-469a-a70f-4939d38a10d1
"SANOFI AVENTIS U.S., LLCBRIDGEWATER, NJ 08807 USA",54edefe8-b810-4337-b951-4939d38a10d1
"SANOFI CHIMIERUE DE VERDUN, BP 80125, F-76410 SAINT AUBIN LES ELBEUF, FRANCE",54edefe4-57d0-437b-9953-4939d38a10d1
"Sanofi Clir54 Avenue de la Boetie, 75008, Paris, France",54edefe8-7ff8-41aa-9b2e-4939d38a10d1
"SANOFI INDIA LIMITEDPLOT NOS 3501, 3503-15, 6310 B-14, GIDC ESTATE, ANKLESHWAR 393 002, DIST. BHARUCH,Gujarat, INDIA",54edefe9-6ef4-4a6c-a45c-4939d38a10d1
"SANOFI PASTEUR LIMITED1755 STEELES AVENUE WEST, TORONTO, ONTARIO, CANADA, M2R 3T4",54edefd8-63f4-4223-8c0c-4939d38a10d1
"SANOFI PASTEUR S.A.1541, AV. MARCEL-MERIEUX, 69280 MARCY L'ETOILE FRANCE58, AVENUE LECLERC, 69007 LYON, FRANCE",54edefd8-1368-4c54-8066-4939d38a10d1
"SANOFI PHARMA BRISTOL-MYERS SQUIBB SNC174, AVENUE DE FRANCE, 75013 PARIS, FRANCE",54edefe8-5f98-4ece-8199-4939d38a10d1
"SANOFI SA/AGROUTE CANTONALE, CH-1902 EVIONNAZ SWIZERLAND",54edefe7-1ba0-47dd-a62b-4939d38a10d1
"SANOFI SYNTHELABO LIMITEDEDGEFIELD AVENUE,FAWDON,NEWCASTLE-ON-TYNE,TYNE & WEAR NE3 3TT,UNITED KINGDOM",54edefe8-0a20-4291-a124-4939d38a10d1
"SANOFI SYNTHELABO OTC9, RUE DU PRESIDENT ALLENDE-94258 GENTILLY CEDEX-FRANCE",54edefe4-2f40-4343-ad4d-4939d38a10d1
"SANOFI SYNTHELABO SACARRETERA DE LA BATLLORIA A HOSTALRIC KM 1,4 RIELLS I VIABREA SPAINAVINGUDA LITORAL MAR 12-14 5A PLANTA 08005 BARCELONA SPAIN",54edefe7-5c1c-4db3-a10f-4939d38a10d1
"SANOFI SYNTHELABO VIET NAM PHARMACEUTICAL SHAREHOLDING COMPANY15/6 C DANG VAN BI STREET, THU DUC DISTRICT, HO CHI MINH CITY, VIETNAM",54edefe9-9cc8-49e6-8f89-4939d38a10d1
"SANOFI WINTHROP ,DIVISION OF STERLING WINTHROP INC.MCPHERSON, KANSAS, U.S.A.NEW YORK, N.Y. 10016, U.S.A.",54edefd8-b778-44b9-94c2-4939d38a10d1
"SANOFI WINTHROP INDUSTRIE9 RUE DU PRESIDENT ALLENDE 94258 GENTILLY FRANCE",54edefe3-e59c-4a71-bd31-4939d38a10d1
"Sanofi Winthrop Industries56,ROUTE DE CHOISY AU BAC,60200 COMPIEGNE,FRANCE(POSTAL CODE:60205)",54edefe8-1370-47d9-bdc9-4939d38a10d1
"SANOFI WINTHROP LIMITED.EDGEFIELD AVENUE NEWCASTLE-UPON-TYNE NE3 3TT U. K,",54edefda-9ae4-4662-a705-4939d38a10d1
"SANOFI WINTHROP, PHARMACEUTICALS.NEW YORK N.Y. 1001690 PARK AVENUE NEW YORK NY 10016",54edefe5-763c-4605-be1f-4939d38a10d1
"SANOFI-AVENTIS DEUTSCHLAND GMBHINDUSTRIEPARK HOECHST,D-65926 FRANKFURT AM MAIN,GERMANY",54edefda-027c-458d-846b-4939d38a10d1
"SANOFI-AVENTIS DEUTSCHLAND GMBH, INDUSTRIEPARK HOECHSTBRUNINGSTRASSE 50, D-65926 FRANKFURT (MAIN), GERMANY",54edefdb-4108-43ba-8a94-4939d38a10d1
"SANOFI-AVENTIS DEUTSCHLAND GMBH,INDUSTRIEPARK HOECHSTD-65926 FRANKFURT AM MAIN,GERMANY",54edefdb-b058-4b67-8e78-4939d38a10d1
"SANOFI-AVENTIS FRANCE1-13, BOULEVARD ROMAIN ROLLAND 75014 PARIS, FRANCE",54edefe5-589c-4210-b7be-4939d38a10d1
"SANOFI-AVENTIS FRANCE S.A.1-13, BOULEVARD ROMAIN ROLLAND 75014 PARIS, FRANCE",54edefe8-ff74-4946-8199-4939d38a10d1
"SANOFI-AVENTIS OTC1-13, BOULEVARD ROMAIN ROLLAND 75014 PARIS, FRANCE",54edefe8-f114-4a1f-8f16-4939d38a10d1
"Sanofi-Aventis S.p.A.LOCALITA VALCANELLO, 03012 ANAGNI (FR), ITALY",54edefe7-8194-4ebc-acb2-4939d38a10d1
"SANOFI-AVENTIS U.S. LLC10236 MARION PARK DRIVE KANSAS CITY MISSOURI 64137 U.S.A.",54edefe8-9ec4-42a5-96df-4939d38a10d1
"SANOFI-AVENTIS, S.A.CARRETERA C-35 DE LA BATLLORIA A HOSTALRIC, KM63.09 17404 RIELLS I VIABREA-GIRONA, SPAIN",54edefe6-2094-4b1c-a885-4939d38a10d1
"SANOFI-SYNTHELABO FRANCE174, AVENUE DE FRANCE 75013, PARIS, FRANCE",54edefe6-e560-4651-ae2a-4939d38a10d1
"SANOFI-SYNTHELABO KOREA CO.,LTD.778-3, WONSI-DONG, ANSAN-SI KYOUNGKI-DO",54edefe4-9248-4e69-a344-4939d38a10d1
"SANOFI-SYNTHELABO LIMITEDEDGEFIELD AVENUE NEWCASTLE-UPON-TYNE NE3 3TT U. K,",54edefe9-1c84-4abc-bf6a-4939d38a10d1
"SANOFI-WINTHROP S.A.LER KM AV. PEANIA-MARKOPOULO 19002 PEANIA,GREECE.",54edefe5-479c-4ef8-8831-4939d38a10d1
"SANOL GMBHMITTELSTRASSE 11-13 D-40789 MONHEIM, GERMANY",54edefd9-bb78-4b2a-8d44-4939d38a10d1
"SANORANIA1 BERLIN 28 DUSTERHAUPTSTRABE 30",54edefe3-0f04-4043-8af9-4939d38a10d1
"SANRAKU-OCEAN CO. LTD.OSAKA TSUKUDA, 4-CHOME NISHIYODOGAWA-KU OSAKA",54edefe3-afb8-4625-a935-4939d38a10d1
"SANSHO CO., LTD.262-1. AYA-YATOHJI, NISHITOMIDA, HONJO-SHI, SAITAMA-KEN",54edefe6-cb38-490e-9633-4939d38a10d1
"SANTEN OY.NIITTYHAANKATU 20 FI-33720 TAMPERE, FINLAND",54edefe2-4bd0-48f1-8989-4939d38a10d1
"SANTEN PHARMACEUTICAL CO. LTD.(NOTO PLANT)2-14, SHIKINAMI, HODATSUSHIMIZU-CHO, HAKUI-GUN, ISHIKAWA, JAPAN",54edefe2-c404-4748-b2b2-4939d38a10d1
"SANTEN PHARMACEUTICAL CO., LTD. NOTO PLANT2-14, SHIKINAMI, HODATSUSHIMIZU-CHO, HAKUI-GUN, ISHIKAWA, JAPAN",54edefea-12bc-40a8-af6a-4939d38a10d1
"SANTEN PHARMACEUTICAL CO., LTD. OSAKA PLANT9-19 SHIMOSHINJO 3-CHOME, HIGASHIYODOGAWA-KU, OSAKA. JAPAN",54edefe4-a80c-4912-9312-4939d38a10d1
"SANTEN PHARMACEUTICAL CO., LTD. SHIGA PLANT348-3, AZA-SUWA, OAZA-SHIDE, TAGACHO INUKAMIGUN, SHIGA, JAPAN",54edefe2-e1fc-457d-8995-4939d38a10d1
"SANWA CHEMICAL CO. LTD.8,1-CHOME KANDA NISHIKIMACHI CHIYODA-KU TOKYO",54edefda-6d5c-4162-8880-4939d38a10d1
"SANWA KAGAKU KENKYUSHO CO. LTD.2100, UROGOGAWA, IWAKOSO-MACHI, UTO-SHI, KUMAMOTO, 869-0412, JAPAN",54edefe5-68a0-4978-ba62-4939d38a10d1
"SANWA KAGAKU KENKYUSHO CO., LTD.2100, UROGOGAWA, IWAKOSO-MACHI, UTO-SHI, KUMAMOTO, 869-0412,TAPAN35, HIGASHISOTOBORI-CHO, HIGASHI-KU, NAGOYA, 461-8631, JAPAN",54edefd9-6b1c-4357-9aa7-4939d38a10d1
"SANWA SEIYAKU CO. LTD.51, 1-CHOME FUKAZAWA-MACHI SETAGAYA-KU TOKYO",54edefda-ef0c-48c0-9392-4939d38a10d1
"SANYO CHEMICAL LABORATORIES CO., LTD.(TOYAMA FACTORY)1-5-1, YASUUCHI, YATSUO-MACHI, TOYAMA-SHI, TOYAMA, JAPAN",54edefe9-1930-4711-b5d3-4939d38a10d1
"SANYO KAGAKU KENKYUSHO148-1, TAJII, MIHARA-CHO, MINAMI KAWACHI-GUN,, OSAKA PREFECTURE, 587",54edefe6-04f8-4334-b883-4939d38a10d1
"SANYO KAGAKU KENKYUSYO CO LTD.TOYAMA FACTORY 5-1 1-CHOME YASUUCHI YATSUOMACHI NEIGUNTOYAMA PREFECTURE JAPAN",54edefe7-5f90-4c86-9dd1-4939d38a10d1
"SANYO YAKUHIN KOGYOKABUSHIKI KAISHONO. 8-6, HIGASHI UENO 1-CHOME TAITO-KU, TOKYO",54edefe5-c0b4-4202-9658-4939d38a10d1
"SARV BIO LABS PVT. LTD.PLOT NO 2, TRILOKPUR ROAD KALA-AMB DISTT. SIRMOUR, H.P. INDIA",54edefe9-c668-4cc2-b77f-4939d38a10d1
"SASAOKA YAKUHIN CORPORATIONNO. 761, SHIIGI CHO, YAMATO 2-CHOME KITA-KU, OSAKA",54edefe6-f790-4268-ae82-4939d38a10d1
"SATO PHARMACEUTICAL CO. LTD.5-8, HIGASHI-OHI, 6-CHOME, SHINAGAWA-KU TOKYO",54edefe2-95a8-4ccf-9dde-4939d38a10d1
"SATO PHARMACEUTICAL CO. LTD. (Hachioji Factory)1468 HAZAMA-CHO,HACHIOJI-SHI, TOKYO, JAPAN",54edefe6-50d0-4370-9fe6-4939d38a10d1
"SATO PHARMACEUTICAL CO., LTD. HACHIOHJI FACTORY1468 HAZAMA-CHO HACHIOHJI, TOKYO, JAPAN",54edefe9-6a30-440c-9e9e-4939d38a10d1
"SATO PHARMACEUTICAL CO., LTD. HACHIOJI FACTORY1468, HAZAMA-CHO, HACHIOJI-SHI, TOKYO, JAPAN",54edefe7-fc68-40cc-8ddc-4939d38a10d1
"SATO YAKUHIN KOGYO CO., LTD.9-2, KANNONJI-CHO KASHIHARA-SHI, NARA JAPAN",54edefe7-4164-48da-b30c-4939d38a10d1
"SATWIK DRUGS LTD.78-B KOLHAR INDUSTRIAL AREA BIDAR-585 403 KARNATAKA INDIA",54edefe8-05b8-43db-ae74-4939d38a10d1
"SAURAV CHEMICALS LIMITEDVILLAGE BHAGWANPURA DERABASSI - BARWALA ROAD, DERABASSI, DISTRICT MOHALI, PUNJAB -140507, INDIA",54edefea-2a58-43a1-932b-4939d38a10d1
"SAURAV CHEMICALS LIMITED (UNIT-III)PLOT NO.370, INDUSTRIAL AREA, PHASE-II, PHANCHKULA (HARYANA) 134109, INDIA",54edefea-8db4-4a88-badd-4939d38a10d1
"SAURAV CHEMICALS LTD.VILLAGE : BHAGWANPURA DERA BASSI - BARWALA ROAD, DERA BASSI, DISTT :  MOHALI, PUNJAB - 141507, INDIA",54edefea-5aec-4903-90e1-4939d38a10d1
"SAVOY LAB. LTD.KILBURN HIGH ROAD, LONDON N.W. 6/ENGLAND",54edefe5-e6fc-4b8b-bc6b-4939d38a10d1
"SAWAI PHARMACEUTICAL CO. LTD.4-25, AKAGAWA, 1-CHOME, ASAHI-KU OSAKA 535",54edefe3-e86c-4467-b0cc-4939d38a10d1
"SAWAI PHARMACEUTICAL CO., LTD. SANDA FACTORY2-1, TECHNO PARK, SANDA CITY, HYOGO PREFECTURE, JAPAN",54edefe4-f580-49fc-8112-4939d38a10d1
"SB PHARMCO PUERTO RICO INC.ROAD 172, KM9.1 BO. CERTENEJAS, CIDRA, PUERTO, RICO 00739 (MAILING ADDRESS:P.O. BOX 11975 CIDRA PUERTO RICO 00739-1975)",54edefe8-51c8-41c4-a765-4939d38a10d1
"SCALARI ISTITUTO FARMACEUTICOMILAN",54edefe2-5f30-4f58-9839-4939d38a10d1
"SCANCHEM A/S.SMEDELAND 5, 2600 GLOSTRUP, DENMARK",54edefe6-f550-4ab0-8ebc-4939d38a10d1
"SCANPHARM A/S (= SCANDRUG PHARMACEUTICAL FACTORY.)33 INDUSTRIPARKEN DK 2750 BALLERUP COPENHAGEN,DENMARK",54edefda-98c0-487c-9e26-4939d38a10d1
"SCHAPER & BRUMMER GMBH & CO.KGD-38259 SALZGITTER ,GERMANY.",54edefd9-7408-4544-a20d-4939d38a10d1
"SCHARPER S.P.A. (PER 1'INDUSTRIA FARMACEUTICAL)20090 RODANO (MI) VIA GIOVANNI XXIII 45",54edefe2-f418-470a-a941-4939d38a10d1
"SCHERING AGMUELLERSTRASSE 178, D-13353 BERLIN GERMANY",54edefe1-5f48-4fc1-9c65-4939d38a10d1
"SCHERING AG (BERGKAMEN)ERNST-SCHERING STRASSE 14 59192 BERGKAMEN GERMANY",54edefe2-ac14-4698-85f1-4939d38a10d1
"SCHERING CORP.60 ORANGE STREET, BLOOMFIELD N.J. 07033",54edefda-285c-4808-b467-4939d38a10d1
"SCHERING CORPORATION CENTROAMERICA, S.A.APARTADO 1101 ZONA LIBRE DE COLON, COLON R. DE.",54edefd8-0ca0-4e98-81e6-4939d38a10d1
"SCHERING GMBH UND CO PRODUKTIONS KGDOEBEREINER STR.20 D-99427 WEIMAR GERMANY",54edefe7-af00-44aa-9ec8-4939d38a10d1
"SCHERING OYPANSIONTIE 47, 20210 TURKU, FINLAND",54edefe7-a25c-4589-9049-4939d38a10d1
"SCHERING S.A.RUE DE TOUFFLERS Z.I. DE ROUBAIX-EST 59390 LYS LEZ LANNOY FRANCE",54edefe7-7ad4-4ba4-8953-4939d38a10d1
"SCHERING-PLOUGH2, RUE LOUIS PASTEUR ZONE INDUSTRIELLE 14200 HEROUVILLE SAINT CLAIR FRANCE",54edefe7-c16c-414b-a3a0-4939d38a10d1
"SCHERING-PLOUGH (BRINNY) COMPANYINNISHANNON, CO. CORK,",54edefd9-f62c-4bcf-9b9c-4939d38a10d1
"SCHERING-PLOUGH CANADA INC.3535 ROUTE TRANSCANADIENNE, POINTE-CLAIRE, QUEBEC, H9R 1B4 CANADA",54edefe5-1630-4f4a-b32a-4939d38a10d1
"SCHERING-PLOUGH CORPORATION3535 TRANS-CANADA HIGHWAY POINTE CLAIRE QUEBEC H9R 1B4",54edefe3-cfa4-4eb3-a340-4939d38a10d1
"SCHERING-PLOUGH LABO N.V.INDUSTRIEPARK,30,B-2220 HEIST-OP-DEN-BERG BELGIUM",54edefd9-b8a0-4965-b00a-4939d38a10d1
"SCHERING-PLOUGH PRODUCTS, INC.CARRETERA ESTATAL NO.686 KILOMETRO 0.5 MANATI",54edefe4-3bc8-4568-a7c0-4939d38a10d1
"SCHERING-PLOUGH PTY LTD.11 GIBBON ROAD, BAULKHAM HILLS N.S.W. 2153,AUSTRALIA",54edefe4-7f2c-47b0-b79f-4939d38a10d1
"SCHERING-PLOUGH S.A.2, RUE  LOUIS PASTEUR, 14200 HEROUVILLE SAINT CLAIR, FRANCE",54edefea-085c-4a5f-8b94-4939d38a10d1
"SCHERING-PLOUGH S.P.A.VIA FRATELLI KENNEDY 5, 26833 COMAZZO (LO), ITALY",54edefea-7f58-4290-bf3a-4939d38a10d1
"SCHERING-PLOUGH, S.A.CTRA. NAL. I, KM.36-28750 SAN AGUSTIN DE GUADALIX (MADRID), SPAIN",54edefea-afa4-4db3-aee6-4939d38a10d1
"SCHI-WA GMBHGLANDORF NEAR OSNABRUECK",54edefdb-a2e4-46e1-a798-4939d38a10d1
"SCHIAPPARELLI S.P.A.CORSO BELGIO 86, 10153 TORINO",54edefe5-eaf0-46a9-a585-4939d38a10d1
"SCHIEDAMSCHE MELKZUUR FABRIEK N.V.P. O. BOX 123, ZYLSTRAAT 6, SCHLEDAM",54edefda-9df4-486b-a556-4939d38a10d1
"SCHIWA GMBHP.O.B0X 1180 4519GLANDROFF",54edefe5-6670-42d6-8fd8-4939d38a10d1
"SCHUTZ DISHMAN BIOTECH  LTD.SURVEY NO.48, [AIKI VILLAGE-LODARIYAL, TALUKA-SANAND, DIST, AHMEDABAD, INDIA",54edefe8-3638-41d9-9a1f-4939d38a10d1
"SCHWARZ PHARMA AGMITTELSTR. 11-13, D-40789 MONHEIM F.R. GERMANYALFRED-NOBEL-STR. 10, D-40789 MONHEIM F.R. GERMANY",54edefe6-1f24-4d44-8ba9-4939d38a10d1
"SCHWARZ PHARMA MANUFACTURING INC.FREEMAN FIELD INDUSTRIAL PARK, 1101 ""C"" AVENUE WEST,SEYMOUR IN472745600 COUNTY CINE ROAD,MEQUON,WI53092",54edefe3-3bb4-4233-80b4-4939d38a10d1
"SCHWEIZ SPRENGSTOFF-FABRIK AG.CH-5605 DOTTIKON",54edefe4-a674-4346-979c-4939d38a10d1
"SCIERLABS BASLE AGELSASSERSTRASSE 233 ,BASEL",54edefe4-1990-4b90-9d69-4939d38a10d1
"SCOTT & BOWNE LTD.BEECHAM HOUSE, BRENTFORD, MIDDLESEX",54edefe4-1c3c-4e99-bc25-4939d38a10d1
"SCOTTISH NATIONAL BLOOD TRANSFUSION SERVICE21 ELLEN'S GLEN ROAD EDINBURGH UK EH17 7QT. (DILUENT) B BRAUN MEDICAL LTD.",54edefd9-d81c-4457-a27b-4939d38a10d1
"SEARLE DIVISION OF MONSANTO PLC.WHALTON ROAD,MORPETH,NORTHUMBERLAND NE61 3YA,ENGLANDP.O.BOX 53,LANE END ROAD,HIGH WYCOMBE BUCKS,HP12 4HL ENGLAND",54edefe4-4374-4454-9428-4939d38a10d1
"SEARLE, DIVISION OF MONSANTO AUSTRALIA LIMITED59 LISBON STREET FAIRFIELD N.S.W. 2165 AUSTRALIA",54edefe4-6aa4-497b-b282-4939d38a10d1
"SECOND PHARMA CO., LTD.ZHEJIANG HANGZHOU GULF FINE CHEMICAL ZONE, CHINA",54edefda-4af4-47c5-a4bb-4939d38a10d1
"SEICO EIYO YAKOHIN K. K.NO. 3-28 2-CHOME, HIMEZATO-CHO NISIYODOGAWA-KU, OS-AKA",54edefd9-d3e8-479d-8a76-4939d38a10d1
"SEIKAGAKU CORPORATION7-3-1 KURIHAMA,YOKOSUKA-SHI,KANAGAWA PREFECTURE 239 JAPAN.",54edefe1-7be4-4a38-86e7-4939d38a10d1
"SEIKEN KAGAKU CO. LTD.NO. 4051 OSHIMA-CHO ICHIKAWA-SHI CHIBA",54edefd9-848c-46fe-9493-4939d38a10d1
"SEKHSARIA CHEMICALS LTD.C-21/22 MIDC PHASE II SAGAON DOMBIVLI (E) THANE 421 204 MAHARASHTRA INDIA",54edefe8-7898-4812-8106-4939d38a10d1
"SEKISUI MEDICAL CO., LTD.4-115, MATSUO, HACHIMANTAI CITY, IWATE PREFECTURE,028-7305,JAPAN",54edefe3-c520-4b6c-b816-4939d38a10d1
"SEKISUI MEDICAL CO.,LTD4-115,MATSUO,HACHIMANTAI CITY,IWATE PREFECTURE 028-73,JAPAN",54edefe7-d5fc-4920-bd40-4939d38a10d1
"SENDAI KOBAYASHI PHARMACEUTICAL CO. LTD.4-3 MATSUSAKADAIRA TAIWA-CHO KUROKAWA-GUN MIYAGI JAPAN",54edefe8-4c80-485b-b539-4939d38a10d1
"SENJU PHARMACEUTICAL CO. LTD.767-7,AZA KAZUKANOUNONISHI,SAIJI, FUKUSAKICHO,KANZAKIGUN,HYOGO-KEN,JAPAN.5-8 HIRANOMACHI 2-CHOME, CHUO-KU, OSAKA, JAPAN.",54edefda-7cc0-4b8a-b7a0-4939d38a10d1
"SENJU PHARMACEUTICAL CO. LTD.,FUKUSAKI PLANT767-7,AZA KAZUKANOUNONISHI,SAIJI, FUKUSAKICHO,KANZAKIGUN,HYOGO-KEN,JAPAN",54edefea-67e8-44d9-a883-4939d38a10d1
"SEPTODONT(SITE ADDRESS)58, RUE DU PONT DE CRETEIL 94100 SAINT MAUR DES FOSSES FRANCE (MAILING ADDRESS)58, RUE DU PONT DE CRETEIL 94107 SAINT MAUR DES FOSSES CEDEX FRANCE",54edefe6-7318-447b-8b27-4939d38a10d1
"SERONO S.A.15 BIS, CHEMIN DES MINES, CASE POSTALE 54, 1211 GENEVA 20, SWITZERLAND",54edefd8-3a8c-4f2f-9f26-4939d38a10d1
"SEROTHERAPEUTISCHES INSTITUT WIEN GES, M.B.H.TRIESTERSTRA E 50 ,A-1100  VIENNA",54edefd9-a4a4-4f24-95a3-4939d38a10d1
"SEROYAL BRANDS INC.CONCORD CALIFORNIA 94524",54edefe4-aa88-4951-b1b5-4939d38a10d1
"SERUMWERK BERNBURG AGHALLESCHE LANDSTRABE 105B, 06406 BERNBURG, GERMANY",54edefe8-ec9c-4217-aa98-4939d38a10d1
"SERVIER (IRELAND) INDUSTRIES LTD.GOREY ROAD, ARKLOW, CO. WICKLOW, IRELAND",54edefd9-2f48-4762-a17b-4939d38a10d1
"SERVIPHARM LTD.CH-4002 BASLE",54edefe5-df44-4f9b-82cc-4939d38a10d1
"SETON HEALTHCARE GROUP PLCTUBITON HOUSE,MEDLOCK STREET,OLDHAM OL1 3HS,ENGLAND.",54edefda-c278-410e-8479-4939d38a10d1
