台中市西屯區西屯路3段139-10、11號,120.623338,24.185527
新竹市東區三民里民族路60號,120.975722,24.806524
高雄市楠梓區翠屏里德賢路265號,120.3040657,22.7261843
高雄市前金區自強一路63號,120.2929452,22.6310612
臺中市東區十甲東路768、768-1、768-2及768-3號,120.7103697,24.1484294
台中市南區建成路1550號,120.6773437,24.1267217
高雄市前金區自強一路18號,120.2938669,22.629415
台中市西區公益路238號,120.6554894,24.1510278
高雄市前金區草江里中華三路182號,120.2950612,22.6319528
高雄市左營區果峰里中華一路5–2號,120.2869709,22.6695608
台中市南區台中路156號,120.6844111,24.1310814
高雄市三民區義華路394號,120.3332677,22.643638
臺中市西屯區台灣大道3段566號,120.6400747,24.168819
台中市昌平路一段372號,120.690651,24.174845
高雄市鹽埕區五福四路306號,120.279764,22.625777
台北市文山區興隆路2段189號,121.5494213,25.0007681
臺中市北屯區中清路二段586號,120.6657967,24.182748
臺中市沙鹿區沙田路94號,120.5589157,24.2344209
基隆市中正區中正路728號,121.769497,25.1519759
高雄市新興區民生一路349號,120.303521,22.6270439
台中市北區健行里西屯路一段351-8，351–9號,120.664915,24.160699
台北市文山區興隆路4段54-7號,121.560923,24.9859919
高雄市楠梓區加昌里加昌路664號,120.2967343,22.7152242
新竹市東區新莊里光復路一段360之5號,121.0175279,24.7833253
高雄市左營區軍校路218號,120.292651,22.693331
高雄市仁武區仁雄路15-1號,120.3540854,22.680976
台北市北投區裕民二路49巷7號,121.5173214,25.1162613
台中市北屯區三光里北屯路192–4號,120.695229,24.16607
高雄市前金區社東里長生街33號,120.2957747,22.6221185
台中市南屯區永春東七路898號,120.6333526,24.1505852
臺南市南區灣裡路224號,120.1815946,22.9278235
基隆市仁愛區忠一路20號,121.7397258,25.131363
台北市文山區興隆路1段273號,121.5444203,24.9989946
臺中市潭子區潭興路三段78號,120.702235,24.211645
臺南市麻豆區三民路2-6號,120.2456595,23.1842025
台北市信義區松山路483號,121.5780689,25.0390934
高雄市苓雅區福隆里福德三路66號,120.3280885,22.6206089
新竹市東區科園里科學園區力行一路18號,121.0180857,24.7713105
台北市中正區館前路49號,121.5151541,25.0448979
高雄市三民區鼎泰里裕誠路108號,120.3129233,22.6639988
臺南市永康區西灣里永華路131號,120.2595238,23.0090969
高雄市三民區九如二路419號,120.3008012,22.6411076
高雄市前金區青山里大同一路224號,120.2995055,22.628568
台北市中正區汀州路1段194號,121.509197,25.028103
高雄市鳳山區五甲三路14號,120.3279565,22.5932435
臺中市南屯區大昌街122號,120.6521502,24.1449261
台中市西區和龍里日新街77-1號,120.6728826,24.1508167
台中市東區曙峰里忠孝路227號,120.6944233,24.1427702
高雄市三民區河堤路316號,120.3118857,22.6629297
台中市南屯區大墩路262號,120.650127,24.1430779
高雄市楠梓區德祥路149號,120.3092768,22.7265938
高雄市鼓山區九如四路1410號,120.2792788,22.6581753
台北市萬華區貴陽街2段148號,121.5015856,25.0401285
高雄市左營區果峰街12巷16號,120.2885059,22.6719312
台中市西屯區大墩路949之23號,120.651774,24.1592839
新竹市科學園路12-1號,121.0095216,24.7863766
新竹市北區客雅里經國路二段541號,120.9553936,24.8039237
高雄市三民區建國三路463號,120.29023,22.635715
台中市南屯區三厝里黎明路2段460號,120.6350976,24.1523849
台中市東區福仁街146號,120.6891185,24.1443885
台北市萬華區康定路18之3號,121.502954,25.0452739
新竹市新興里西大路135巷12號,120.96934,24.79638
台中市南屯區河南路4段368號,120.6369757,24.15177
臺南市仁德區中正路1段179號,120.2344987,22.9203657
新竹市香山區牛埔東路300號,120.9401784,24.7947993
高雄市小港區正苓里沿海一路191號,120.352018,22.566511
高雄市岡山區仁義路36號,120.295189,22.7865366
台中市北區進化北路265號,120.683421,24.162921
高雄市楠梓區後昌路八六二之一號,120.2945314,22.7124454
高雄市苓雅區成功一路155號,120.2968532,22.6158532
高雄市鼓山區大順一路841號,120.299698,22.655141
台北市北投區石牌路2段116號,121.517168,25.117759
高雄市旗津區中洲三路99–1號,120.280137,22.598147
高雄市小港區漢民路693-2號,120.361659,22.567707
台北市萬華區廣州街72號,121.50297,25.0364861
台中市西區和龍里日新街80號,120.6727159,24.1510719
台中市西屯區西屯路2段296之20號,120.641544,24.1784389
基隆市仁愛區愛三路57號,121.7425835,25.128599
高雄市前鎮區復興三路186號,120.311564,22.613012
臺南市學甲區仁得里華宗路355號,120.1822583,23.2318798
台北市信義區松山路465巷11號,121.578717,25.039847
台中市西區五權路29號,120.669612,24.1442339
高雄市仁武區仁雄路36-6號,120.3509609,22.680809
台中市西屯區永福路六十六號,120.620393,24.183249
高雄市三民區明誠一路710號,120.318382,22.6599847
新竹市東區東門街16號,120.974428,24.804424
臺中市西區臺灣大道2段218號,120.6688479,24.1520415
高雄市前鎮區一心二路49號,120.310255,22.611305
高雄市前鎮區興中里二聖二路149號,120.313467,22.613398
"台中市西區臺灣大道2段 375號",120.6643169,24.1542141
台中市西區臺灣大道2段181號,120.668252,24.151648
高雄市新興區達仁街96號,120.309002,22.630146
高雄市鼓山區臨海二路13號,120.274332,22.621441
新竹市東大路二段577號,120.9585184,24.8227899
高雄市三民區大昌二路142號,120.3322203,22.6442154
台北市萬華區東園街22號,121.4956873,25.0274129
高雄市鹽埕區建國四路243號,120.2814348,22.6280547
台中市北區金龍里北屯路73巷5號,120.691438,24.161148
高雄市鼓山區雄峰路5號,120.285499,22.668698
台北市文山區木新路2段273號,121.5661086,24.9829018
台中市北區進化北路392–2號,120.6773116,24.1633586
台北市信義區忠孝東路5段388號,121.574247,25.040697
基隆市安樂區基金一路133-5號,121.7114471,25.1402859
台中市西區土庫里忠明南路465號,120.6575667,24.1373424
高雄市苓雅區正義路112號,120.33909,22.630396
臺南市安平區慶平路517號,120.1722692,22.9970943
台中市西屯區何南里大墩路917–1號,120.650553,24.15712
臺南市東區崇善路245號,120.2257631,22.9787903
台北市文山區興隆路4段217號,121.5625094,24.9825355
高雄市苓雅區奏捷里福壽街193號,120.3263257,22.6264571
台中市南屯區南屯里黎明路一段1059，1061號,120.6375077,24.138701
高雄市新興區復興一路107–1號,120.3082012,22.6328768
台北市北投區中央南路1段155號,121.501149,25.1295659
高雄市美濃區祿興里中正路二段168號,120.5364852,22.8889539
高雄市小港區宏平路497號,120.355036,22.569654
台中市北區頂厝里進化北路118巷51．53號,120.687757,24.1655919
高雄市左營區左營大路103號,120.288417,22.68321
高雄市苓雅區建國一路115號,120.3330282,22.6314174
新竹市東區經國路一段680號,120.9737242,24.8145185
高雄市三民區覺民路69號,120.3432801,22.6387647
高雄市三民區天祥一路200號,120.318229,22.668012
高雄市左營區民族一路1032號,120.3202427,22.6839952
臺中市西屯區西屯路2段103-5號,120.6515604,24.1666859
高雄市三民區明誠一路692號,120.3189769,22.6601177
新竹市東區成功里武昌街18號,120.9685315,24.8008318
臺南市永康區西橋里中山南路31號,120.2268093,23.0118932
基隆市中正區義一路23號,121.7454455,25.1328704
臺中市豐原區中正路246號,120.716815,24.252095
基隆市七堵區百三街29號,121.6955584,25.0820231
台中市南區工學路8-3號,120.6675512,24.1170465
台中市中區建國里建國路175號,120.684931,24.1379829
新竹市北區中山里中山路33號,120.9671711,24.8055189
台中市西屯區惠中路一段118號,120.6434229,24.1597136
臺中市南屯區東興路三段157號,120.6528934,24.1500457
高雄市三民區正順里建興路406號,120.321392,22.648032
臺南市永康區中正南路815號,120.236249,23.0408051
臺中市西區五權西路一段273號,120.6553598,24.1400082
台北市北投區中央南路1段25巷3號,121.5014845,25.1325443
高雄市三民區大昌二路482號,120.3311344,22.650932
台北市文山區景興路129號,121.544909,24.9944479
臺中市南屯區干城街360號,120.6349738,24.1525449
臺中市南區復興路2段34–1號,120.6597095,24.1190594
台北市信義區永吉路236號,121.573862,25.045369
臺南市北區文成里和緯路三段285號,120.1957985,23.0098503
基隆市安樂區安一路216號,121.731615,25.132741
台中市北屯區中清路2段12號,120.6665245,24.1796939
台中市西屯區櫻花路116號,120.6503246,24.1713772
高雄市左營區文慈路150號,120.31807,22.681811
新竹市東區東門街77號,120.971345,24.803869
台中市南屯區忠勇路25-6號,120.6120712,24.137586
臺中市南屯區河南路四段393號,120.6375651,24.1511093
高雄市楠梓區益群路6號,120.2977543,22.723649
高雄市小港區孔鳳路416號,120.3611746,22.5814291
高雄市前鎮區光華二路68號,120.31748,22.60963
基隆市中山區復興路328之4號,121.727058,25.149491
高雄市小港區順苓里漢民路337號,120.355207,22.567089
高雄市左營區裕誠路421號,120.3065865,22.6653468
臺南市中西區西門路1段452號,120.1977214,22.9828398
台中市西屯區上石里青海路2段209–3號,120.6446219,24.1707724
高雄市新興區洛陽街1號,120.309078,22.632746
高雄市三民區天祥一路135-1號,120.3200633,22.6672941
台中市東區東明里精武路117號,120.6944233,24.1427702
台北市中正區懷寧街78號,121.51395,25.043096
臺中市西屯區光明路67號,120.638466,24.178682
高雄市前金區五福三路63號,120.2965959,22.6214004
基隆市信義區深澳坑路1之54號,121.7738256,25.1366243
臺中市太平區樹孝路265號,120.7183454,24.1537872
臺南市北區開元路132號,120.2191312,23.0068242
台北市萬華區漢中街152號,121.506722,25.0413549
台北市萬華區貴陽街2段103號,121.5034765,25.0399445
高雄市三民區寶國里陽明路132號,120.3416707,22.6406518
高雄市左營區翠華路609號,120.2911418,22.6719906
台中市北屯區松竹里昌平路二段11-9號,120.6892745,24.1807279
台北市信義區忠孝東路4段563號,121.56405,25.0415889
臺南市永康區永大路2段147、149號,120.2611586,23.0054641
高雄市鼓山區明華路303號,120.3003755,22.6632243
高雄市新興區秋山里中山一路225號,120.301921,22.63425
高雄市前鎮區永豐路214號,120.3333286,22.6087133
高雄市鼓山區中華一路310號,120.2914192,22.6655875
高雄市三民區建工路648號,120.321936,22.649148
台北市中正區羅斯福路2段70號,121.5220343,25.0272439
台中市北區賴明里天津路2段166號,120.677521,24.169673
台北市信義區忠孝東路5段508之4號,121.578639,25.0407889
台中市北區遠志里民族路248號,120.674583,24.1629451
高雄市左營區大順一路268號,120.307364,22.657153
高雄市新興區德生里五福一路86號,120.313761,22.627504
高雄市前鎮區瑞平里崗山南街470號,120.3298024,22.6010532
高雄市新興區南港里忠孝一路508號,120.3066147,22.6362196
台中市南屯區大英街453號,120.648611,24.1521409
臺中市南區工學路46號,120.6660636,24.1169913
高雄市苓雅區四維三路77、79號,120.309702,22.618836
高雄市三民區信國路1號,120.3391378,22.6468172
高雄市三民區大豐二路288號,120.332946,22.645497
高雄市前鎮區永豐路158號,120.333463,22.6075037
臺中市西屯區大福里大鵬路9號,120.668149,24.1780842
台北市萬華區西園路1段109號,121.4998714,25.0382142
高雄市三民區熱河一街365號,120.305885,22.643607
台北市信義區松山路130號,121.577583,25.0475429
台北市信義區嘉興街175巷3號,121.5573839,25.0277952
台中市西區五權路二○一號,120.6631289,24.1430604
高雄市鳳山區文化路25號,120.357879,22.633303
高雄市新興區中正三路63號,120.3077475,22.6308216
臺中市中區民權路100號,120.678242,24.1398119
高雄市鳳山區五甲二路501號,120.333087,22.596212
新竹市東區福德里中華路2段704號,120.9646307,24.7978429
台北市北投區西安街1段359號,121.5153328,25.1142483
高雄市左營區重愛路218號,120.315641,22.6856371
台中市西屯區福安路5號,120.6232101,24.1824308
高雄市楠梓區建楠路108．110號,120.327696,22.727124
基隆市中正區信一路162號,121.7458299,25.1301946
"台北市中正區汀州路1段 96號",121.5074564,25.0302154
基隆市中正區義二路65-1號,121.7458397,25.1319211
臺中市北區五權路232號,120.676914,24.1508393
台中市西區五權三街57號,120.6635059,24.1379108
臺南市安南區梅花里安中路一段753號,120.1943992,23.0434899
台北市北投區中央南路1段162號,121.500948,25.1294039
基隆市仁愛區仁二路117號,121.7480457,25.1274013
臺南市歸仁區中山路一段519號,120.298412,22.9662201
高雄市苓雅區青年一路1-18號,120.31573,22.624433
高雄市苓雅區凱旋二路128號,120.3242682,22.6244103
台北市中正區羅斯福路2段70號,121.5220343,25.0272439
高雄市苓雅區青年二路149號,120.2955849,22.6176928
臺中市南屯區寶山東一街5號,120.6166746,24.1517521
高雄市前鎮區一心二路57號,120.310075,22.611379
基隆市中正區義一路76號,121.7461812,25.1333907
台北市北投區中央南路1段13號,121.5015278,25.1328318
台中市北區五權路232號,120.676914,24.1508393
新竹市中央路100號,120.9689307,24.8055877
台中市北屯區陳平里中清路60-5號,120.6689792,24.1781062
台北市文山區羅斯福路6段318號,121.5395637,24.9902612
高雄市苓雅區四維一路157號,120.3246258,22.6240919
台北市文山區景興路45號,121.544873,24.9970569
高雄市旗津區通山路31號,120.268671,22.613
臺中市西屯區何安里青海路一段112號,120.6543095,24.1648883
台北市萬華區武成街63巷12弄49號,121.494156,25.0188019
台中市南屯區向上南路1段343號,120.6472076,24.1447532
台中市西區公民里民生路145之4號,120.6716819,24.1421686
高雄市苓雅區正義路136號,120.3394381,22.6309309
高雄市三民區正忠路185號,120.330303,22.643591
基隆市暖暖區暖暖街171號,121.7361095,25.0994807
台中市南區萬安里國光路71號,120.6624117,24.1208445
台中市南區美村南路203號,120.666574,24.11508
臺中市北屯區軍功里東山路一段289-11號,120.7197078,24.176001
高雄市三民區正興里正興路167號,120.319653,22.646832
高雄市新興區忠孝一路19號,120.3070248,22.6223366
高雄市阿蓮區中正路383號,120.3330953,22.8807038
高雄市苓雅區青年二路81．83號,120.2989466,22.6188241
新竹市東區民族路158-2號,120.9787172,24.8086948
高雄市鳳山區中山路146-2號,120.357013,22.625149
臺南市北區成功里北安路一段188號,120.2079962,23.0180349
高雄市三民區九如一路896號,120.317494,22.640306
台中市南屯區大同里東興路二段249號,120.6528155,24.1429712
新竹市東區西大路23號,120.9724669,24.7945351
高雄市左營區華夏路1083號,120.307343,22.683148
高雄市三民區大裕路256號,120.3288053,22.6602425
高雄市鼓山區民強里九如四路694號,120.279265,22.65004
臺中市東勢區中山路28號,120.8306043,24.2575086
臺南市新營區民生里民生路52號,120.3089528,23.30635
臺南市佳里區鎮山里延平路76號,120.1794105,23.155382
台中市南屯區永春東路878號,120.640611,24.135173
基隆市仁愛區仁五路57號,121.740441,25.127469
高雄市苓雅區自強三路93號,120.298817,22.615915
基隆市中山區復興路176號,121.726895,25.145328
台中市北屯區中清路2段326號,120.6657967,24.182748
高雄市新興區復興一路22號,120.308185,22.628995
臺南市中西區民權路1段232號,120.2074338,22.9927201
臺中市北屯區東山路一段298之2號,120.7201884,24.1759074
高雄市苓雅區福德二路47號,120.3278661,22.6314444
台中市北區仁和里太平路157號,120.681026,24.1489229
台中市東區新庄里復興路四段54號,120.684275,24.134804
新竹市東區食品路321號,120.9721573,24.794387
台中市西區靖龍里民權路231號,120.6631289,24.1430604
台中市西屯區文華路2–10號,120.644803,24.175012
臺南市中西區民生里永華路一段252號,120.190302,22.988659
臺南市東區崇明路650號,120.225497,22.971718
新竹市香山區香山里大庄路106號,120.9261103,24.7913798
台中市南屯區文山里忠勇路70–9號,120.615949,24.1499349
高雄市左營區左營大路12-2號,120.2875644,22.6797044
臺中市南區復興路三段148號,120.6734564,24.1303863
高雄市苓雅區建國一路113-2號,120.3331774,22.6313013
臺中市大里區中興路2段349號,120.6897517,24.1109339
台北市信義區松德路71號,121.5764789,25.0383688
高雄市三民區九如一路135號,120.340507,22.636651
台中市西屯區福安里中工三路65號,120.6191156,24.1792287
台北市中正區館前路8號,121.5148402,25.0457831
臺中市龍井區中央路一段212-1號,120.5234599,24.201818
新竹市北區中山路29號,120.9672309,24.8055565
台中市東區自由路三段276號,120.6937633,24.1426698
台中市南屯區河南路4段368號,120.6369757,24.15177
台中市南屯區忠勇路46–5號,120.6130772,24.1394894
高雄市三民區九如一路807號,120.3202824,22.6397214
台中市北區健行里民權路477號,120.670205,24.15968
臺中市新社區中興嶺85號,120.788947,24.2082081
台中市西區美村路一段585號,120.6618504,24.1381434
新竹市東區建中路77號,120.9954581,24.8021557
新竹市東區民族路130號,120.9777015,24.8080853
高雄市前鎮區一心一路17號,120.3237575,22.6053303
新竹市南門街14號,120.9678465,24.8003375
高雄市梓官區中崙路265號,120.2711601,22.7613464
基隆市仁愛區仁二路85號,121.748954,25.127486
高雄市苓雅區英明里英明路118號,120.3253534,22.6142199
高雄市三民區九如二路570號,120.295787,22.641978
新竹市北區光華里湳雅街120號,120.973126,24.819658
台中市中區中正路245號,120.680993,24.140847
高雄市三民區天民路125號,120.3432963,22.6434644
高雄市小港區平和路105號,120.3331466,22.5655821
基隆市信義區深澳坑路1之54號,121.7738256,25.1366243
臺中市烏日區中山路1段367號,120.6395604,24.1081757
高雄市苓雅區福建街25號,120.316572,22.618919
高雄市前鎮區永豐路87-89號,120.3333589,22.6058646
高雄市前鎮區正勤路71號,120.305572,22.603048
高雄市揇梓區常德路331號,120.3372017,22.7374754
台中市西區吉龍里美村路1段658號,120.6615212,24.1359046
台中市西區平和里中華路一段3-5號,120.6727577,24.1415657
台中市北區興進路211-2號,120.6924124,24.1554526
臺中市西區美村路一段743號,120.6618581,24.1338296
高雄市三民區澄清路641．641-1號,120.3462459,22.6442366
台北市萬華區艋舺大道168巷7號,121.4999081,25.0326767
台中市北區育樂街2-14號,120.6937657,24.1569791
高雄市新興區五福一路164號,120.311488,22.626801
台中市北區學士路312號,120.6809954,24.1625268
高雄市楠梓區藍田里援中路498號,120.2909391,22.7251516
高雄市左營區左營大路253號,120.2904379,22.6861416
台中市西區向上路1段270號,120.6580902,24.1468064
高雄市苓雅區光華一路145號,120.316108,22.6221
高雄市前鎮區和平二路205號,120.322379,22.6129819
高雄市鳳山區鳳東路368號,120.3767607,22.6227114
基隆市仁愛區孝二路62號,121.74027,25.129406
台中市北屯區東光里北屯路256號,120.6982015,24.1706767
台北市信義區永吉路30巷15號,121.568905,25.0450947
台北市萬華區西園路2段250號,121.4948197,25.0280431
台北市萬華區西藏路261之3號,121.4937534,25.0284656
高雄市楠梓區後昌路915號,120.293727,22.7133842
台北市文山區興隆路4段171號,121.5620706,24.9838807
高雄市前鎮區一心二路47-1號,120.310307,22.611282
臺中市霧峰區甲寅里草湖路62號,120.6979093,24.0688144
高雄市鼓山區美術南三路272號,120.2844372,22.6536538
台中市西屯區青海路一段65之2號,120.6546864,24.1644191
高雄市三民區安吉里九如一路950號,120.316749,22.640341
高雄市楠梓區鳳楠路248號,120.329666,22.72615
臺中市北屯區崇德路二段281號,120.6856143,24.1769714
高雄市左營區實踐路51．53號,120.293015,22.6901926
台中市北區文莊里大雅路27–10號,120.676872,24.153759
台中市西屯區漢口路1段11號,120.6561543,24.1598645
高雄市苓雅區福德二路69號,120.3278367,22.6313029
台中市西屯區政和路152號,120.6407211,24.156828
高雄市前鎮區瑞隆路631號,120.3253069,22.6049297
台中市中區愛松里中正路311號,120.6818181,24.1402601
臺中市南屯區嶺東路918號,120.6127036,24.1537215
臺南市東區東光里怡東路157號,120.2281528,22.9942759
高雄市三民區自強一路197號,120.291459,22.634707
高雄市鹽埕區新樂街120號,120.285426,22.6239674
高雄市左營區明誠二路427號,120.3066499,22.6609468
台中市南區高工路325號,120.6660095,24.1141136
新北市樹林區鎮前街32號,121.425973,24.993007
桃園市中壢區中山路426號,121.2175598,24.9567571
桃園市桃園區民生里廣文街30號,121.312291,24.993785
嘉義市東區興中街145號,120.4510933,23.4803205
新北市深坑區北深路2段200號,121.6151789,25.0025804
嘉義市西區北興街406號,120.4355469,23.4870312
新北市中和區安樂路66號,121.5122238,24.9933281
新北市瑞芳區明燈路3段39-7號,121.806937,25.107893
桃園市龜山區南祥路40號,121.2972172,25.0463223
桃園市龍潭區龍潭里東龍路204號,121.2144269,24.8643799
新北市板橋區篤行路1段31號,121.4321479,24.9945014
新北市新莊區後港一路98號,121.427874,25.026682
臺南市南區大同路二段432號,120.2152026,22.9710387
新北市泰山區明志路1段188號,121.432935,25.0619275
桃園市觀音區新坡里新生路18號,121.1360294,25.0134074
新北市五股區成泰路2段116號,121.4376686,25.0829777
桃園市中壢區中北路二段三八八號,121.2317029,24.9538584
桃園市中壢區環北路184號,121.2218621,24.9662068
新竹縣竹東鎮東峰路五十二號,121.0962913,24.7209177
桃園市桃園區昆明路23號,121.3178473,24.9838126
桃園市中壢區健行路226號,121.2278914,24.9480833
新北市樹林區千歲街45-3號,121.425354,24.9963699
桃園市桃園區莊敬路二段78號,121.293269,25.022913
桃園市蘆竹區錦中里南崁路98號,121.2715069,25.060368
新北市中和區民享街95-5號,121.474913,25.00019
桃園市蘆竹區南昌路二五二號,121.2912013,25.0401476
新北市板橋區中山路2段24號,121.4723766,25.0149932
新竹縣竹北市中正西路31號,121.002049,24.8401147
桃園縣八德市介壽路二段1171號,121.2973884,24.9314065
桃園市大園區大園里中山北路128號,121.1966051,25.0671
台南市南區大同路二段102號,120.2121824,22.9806469
台南市安平區華平路501號,120.1751889,22.9934807
新北市新店區光明街288號,121.54069,24.9644959
新北市三重區自強路4段49號,121.4899868,25.0778465
苗栗縣苗栗市福麗里至公路207號,120.815873,24.559732
桃園市平鎮區中豐路南勢二段100號,121.210685,24.916935
嘉義市東區延平街102號,120.4453957,23.4763441
新北市永和區福和路268號,121.5180787,25.0076122
苗栗縣苗栗市清華里為公路199號,120.827654,24.5711554
桃園市蘆竹區中山路52號,121.3007162,25.0520142
新北市板橋區龍興街51號,121.4431052,25.0009008
台南市中西區青年路108號,120.2085088,22.9919394
台南市安南區同安路400號,120.1936287,23.0444255
新北市永和區中正路46號,121.502077,24.9937665
桃園縣楊梅鎮楊江里光華街42號,121.1449687,24.9081009
新北市新莊區後港一路55號,121.42615,25.026521
新北市新店區北新路3段138號,121.541714,24.982027
桃園市桃園區莊敬路一段342之5號,121.2964729,25.0241312
苗栗縣竹南鎮正南里民治街1號,120.8797748,24.6847771
臺中市北屯區崇德路二段309號,120.68564,24.1777559
嘉義市西區中山路418號,120.4449998,23.4795044
桃園市蘆竹區中正路306號,121.292045,25.047785
台南市西區民生路二段190號,120.1938559,22.9963493
台中市北屯區松竹路2段155號,120.6958055,24.1831111
新北市新店區安康路3段21號,121.49356,24.9532729
桃園市中壢區元化路226號,121.22656,24.961058
新北市烏來區烏來里環山路76號,121.5485095,24.861888
桃園市中壢區元化路275–4號,121.225858,24.9621089
臺南市安南區安中路1段821號,120.1927847,23.0444376
苗栗縣苑裡鎮信義路21號,120.6538425,24.440753
新北市三重區正義北路178號,121.4963879,25.0665805
桃園市八德區大智里介壽路一段812號,121.2997382,24.9622718
新北市土城區延吉街122號,121.4696741,24.9859904
苗栗縣竹南鎮照南里18鄰自由街110號,120.875276,24.6878129
新北市鶯歌區鶯桃路571號,121.3296672,24.9684541
宜蘭縣羅東鎮興東路118號,121.7692342,24.680264
新北市土城區裕民路73號,121.449792,24.987738
台南市安南區鳳凰里怡安路二段511號,120.1961814,23.0443371
新北市板橋區四川路1段81號,121.4596644,25.0057266
新竹縣竹東鎮東榮路2號,121.0978075,24.7226463
台南市北區興北里公園路528號,120.210255,23.00675
苗栗縣頭份鎮土牛里中正路472號,120.9188737,24.6879217
台中市豐原區三民路65號,120.720984,24.25358
新北市蘆洲區中正路55號,121.4706822,25.0826775
新北市板橋區文化路2段53號,121.46912,25.025389
新竹縣竹東鎮竹東里東寧路三段101號,121.0862806,24.7390081
桃園縣桃園市永安北路418號,121.2926272,25.0172054
宜蘭縣宜蘭市中山路2段231號,121.7532989,24.7509599
