高雄市三民區寶安里覺民路596號,120.328963,22.641187
台北市信義區松隆路327號,121.5791505,25.0485352
高雄市苓雅區凱旋三路827號,120.326068,22.61805
"台中市北屯區中清路2段 397號",120.6657967,24.182748
臺中市北屯區昌平路二段11-37號,120.688583,24.1816227
高雄市前鎮區中華五路1011號,120.305349,22.603584
高雄市三民區河堤路290號,120.311968,22.660999
高雄市三民區澄和路27號,120.3454654,22.6442613
高雄市楠梓區楠梓新路127號,120.324324,22.725938
高雄市三民區建國三路393，395號,120.292153,22.636339
高雄市小港區正苓里沿海一路123號,120.351457,22.56788
台中市北屯區松竹路2段196，198號,120.69476,24.183505
台北市萬華區萬大路176號,121.5003917,25.028123
台中市北區中清路一段868號,120.6719286,24.1716784
臺中市后里區福音路26號,120.7134894,24.3051107
台北市北投區文林北路262號,121.5133503,25.1091403
台中市西區五權西路1段275號,120.6553359,24.139915
高雄市左營區富民路301號,120.3050339,22.6640668
高雄市三民區大豐二路110-1號,120.32911,22.645734
臺南市東區崇明路556號,120.2244371,22.9731295
基隆市仁愛區成功一路127號,121.7366212,25.1278364
新竹市中華路2段534號,120.9685255,24.800124
臺中市西區向上路一段343號,120.6565041,24.146558
高雄市仁武區仁樂街178號,120.3476006,22.7038216
基隆市仁愛區南榮路115號,121.7430476,25.1253368
高雄市三民區察哈爾二街78號,120.3010639,22.6478427
台北市中正區忠孝東路1段54號,121.5228695,25.044702
台中市北區博館二街56號,120.6673548,24.1539628
臺中市南屯區大業路306號,120.6477,24.153844
台中市北區忠太東路58之3–6號,120.668244,24.1618948
臺南市鹽水區橋南里月津路27號,120.2665485,23.3156535
高雄市三民區正興里建工路711號,120.316668,22.647688
高雄市三民區敦煌路82號,120.3131472,22.6581294
高雄市新興區南台路68-1號,120.3002636,22.6314924
台中市北屯區東光里北屯路258–1之1號,120.6982088,24.1707001
台北市文山區興隆路2段301巷4-2號,121.5535166,25.0017769
台北市萬華區中華路1段90號,121.5084757,25.0446881
台中市西區公正里東興路3段226．228．230號,120.6531976,24.1528713
基隆市仁愛區南榮路185號,121.7430387,25.1237354
台中市北屯區昌平路一段99–3號,120.6904369,24.173072
台北市萬華區青年路34號,121.504798,25.0257241
基隆市信義區東信路304號,121.7608088,25.1286763
台中市南區永興里工學路13–22號,120.6669654,24.1168437
臺南市善化區大成路202號,120.3006155,23.1302634
高雄市旗山區大同街13-1號,120.4841721,22.883441
高雄市楠梓區樂群路241號,120.2960981,22.7206048
台中市南屯區向上路二段326號,120.639585,24.1472369
高雄市林園區林園里鳳林路二段757號,120.3958212,22.5134783
新竹市北區台溪里林森路297號,120.9612108,24.7970644
高雄市小港區孔鳳路239號,120.363805,22.581224
新竹市東區文化街2號,120.97103,24.804758
台北市信義區莊敬路280號,121.5627329,25.0287559
台中市南區福平里南平路91號,120.6638288,24.1222032
基隆市中山區復興路179號,121.726426,25.14573
高雄市左營區明誠二路210號,120.309442,22.6611997
臺南市北區賢北里和緯路五段210號,120.181665,23.0050616
高雄市前鎮區凱旋三路83號,120.3247667,22.6068403
高雄市楠梓區軍校路884號,120.292146,22.712274
臺中市北區進化路635號,120.69401,24.160817
臺中市南區忠孝路5號,120.6755979,24.1270577
臺中市南屯區東興路二段90號,120.653347,24.1384859
台中市北區錦洲里進化路632之1，636號,120.694647,24.160153
高雄市三民區陽明路99號,120.341436,22.6396558
台中市北區頂庴里進化北路163號,120.68641,24.162839
高雄市前鎮區鎮州路207號,120.309089,22.5889314
新竹市民權路36號,120.9765085,24.8064124
台中市南屯區大業路309號,120.6473486,24.1535113
台中市南屯區清墘里大墩路779號,120.6084832,24.1471183
台中市中區大墩里三民路二段57號,120.6784093,24.1415174
高雄市左營區明誠二路500號,120.305011,22.661399
台中市南屯區黎明路一段229號,120.6269369,24.117329
臺中市潭子區中山路2段227號,120.7052488,24.2098739
台中市西屯區甘肅路1段78號,120.6591655,24.1659156
台中市南屯區大同里南屯路二段121號,120.6518788,24.1359197
台北市中正區忠孝東路1段13號,121.5240713,25.0448459
高雄市小港區小港路237號,120.336387,22.564181
臺南市東區崇信里中華東路3段70號,120.2278613,22.9796176
台中市南屯區溝墘里大墩路508號,120.650144,24.148688
高雄市鳳山區文濱路196號,120.3491697,22.6424534
高雄市左營區廓後街19號,120.2916524,22.6877358
台中市西屯區西屯路3段166-31號,120.6123497,24.1904164
高雄市楠梓區楠都東街209號,120.3267871,22.7264454
台北市文山區羅斯福路5段25號,121.5385435,25.0076892
臺中市西屯區何仁里寧夏路199號,120.6596568,24.1695933
高雄市左營區孟子路415號,120.307046,22.6760212
"臺中市北屯區中清路2段 268號",120.6657967,24.182748
台中市西屯區河南路二段311號,120.6467415,24.1731147
臺中市北屯區軍功路一段457號,120.718561,24.1712641
台中市南區美村南路147號,120.6666751,24.1164118
台中市西屯區福科路702號,120.609446,24.1870836
高雄市楠梓區德民路1002之12．1樓,120.2877565,22.7202791
高雄市左營區左營大路111號,120.2887799,22.683408
高雄市前鎮區林森三路150號,120.308841,22.613645
高雄市三民區鼎泰里明誠一路800號,120.3175052,22.6597933
臺中市西屯區工業區一路2巷3號,120.6141882,24.1824977
高雄市旗津區中洲三路775號,120.269705,22.611811
台中市西屯區漢口路2段24號,120.658083,24.163039
高雄市左營區果峰街12巷16號,120.2885059,22.6719312
高雄市三民區本揚里陽明路416號,120.3429102,22.6462614
高雄市鼓山區明誠三路598號,120.2973536,22.6613124
台中市南屯區南屯路2段510號,120.6429945,24.1384923
台中市北區漢口路4段50號,120.674843,24.166731
高雄市鳳山區南成街38號,120.3317037,22.5969341
臺中市北屯區軍功路一段535號,120.7189752,24.173843
高雄市新興區中山一路59號,120.3014941,22.62971
台北市信義區莊敬路462號,121.5677399,25.0267719
台北市中正區中華路2段325號,121.5063761,25.0277421
台中市西區美村路1段565號,120.6617143,24.139358
臺中市南屯區大業里大昌街541號,120.651988,24.153358
台中市西區臺灣大道2段181號,120.668252,24.151648
高雄市左營區果峰街2巷2號,120.2892459,22.6705971
新竹市東區新莊里光復路一段301號,121.018952,24.7822091
臺南市永康區崑山里大灣路910號,120.2556895,22.9996839
台中市南屯區南屯里黎明路一段1043號,120.6373937,24.1384081
高雄市苓雅區正義路235號,120.340495,22.632728
高雄市新興區青年一路170．172．174號,120.309934,22.622731
基隆市中山區中華路11號,121.738566,25.145285
台北市中正區信義路2段173、171、171之1、165號,121.529182,25.034021
高雄市左營區自由三路392號,120.3125797,22.6752505
高雄市三民區陽明路21號,120.3409292,22.6376331
臺中市北區民權路533號,120.670252,24.1609979
台北市文山區興隆路2段93-1號,121.5470264,24.999405
高雄市三民區正興路163巷2號,120.3197205,22.6466469
高雄市鼓山區裕誠路1940號,120.29402,22.659069
高雄市苓雅區四維二路94之1號,120.3203934,22.6229598
新竹市關帝里南門街86號,120.9670978,24.8020114
新竹市北區武陵路73巷22號,120.9623395,24.8154121
台中市中區重慶里市府路141號,120.6818181,24.1402601
臺中市清水區中興街35-5號,120.575571,24.271645
臺中市北區建興里崇德路一段119號,120.6848484,24.1606702
高雄市三民區建工路302號,120.33163,22.653662
高雄市小港區宏平路356號,120.359288,22.570119
臺中市沙鹿區正義路2號,120.5697033,24.2089511
台北市萬華區萬大路234號,121.5003001,25.0266109
高雄市左營區文康路109號,120.3040384,22.6738824
臺中市南屯區大容東街14號,120.6475116,24.1541581
台中市西區福壽里建國路63號,120.6631289,24.1430604
高雄市鹽埕區瀨南街225之1號,120.2841197,22.6279787
新竹市東區金山里光復路一段147號,121.0227,24.781282
台中市西區五權路2-43號,120.6674454,24.1412187
新竹市北區盤石里西大路738號,120.959111,24.8100751
高雄市鼓山區華豐里華榮路352號,120.296192,22.667689
台中市西區公正里精誠22街44號,120.65649,24.1486069
台中市西區公正里精誠路195號,120.655364,24.1484729
台北市北投區中央南路1段191、193號,121.5011965,25.1286111
高雄市新興區林森一路185號,120.3045646,22.6319237
台中市南屯區大業路198號,120.650236,24.153883
高雄市苓雅區三多一路205號,120.3309512,22.622504
高雄市鼓山區九如四路1660號,120.283133,22.663763
高雄市前金區七賢二路426號,120.2877854,22.6307146
高雄市左營區崇德路238號,120.304755,22.6753154
高雄市左營區華夏路228號,120.296812,22.669949
台中市西屯區弘孝229號,120.6489229,24.1712214
高雄市新興區五福二路72號,120.308789,22.625885
台中市西屯區西屯路2段82號,120.6574257,24.1651727
高雄市左營區民族一路1030號,120.320352,22.683947
高雄市三民區鼎山街598號,120.316967,22.650883
高雄市前金區自強二路20號,120.296575,22.6223531
臺南市東區莊敬路100號,120.2329039,22.9949278
臺中市南屯區南屯路二段275號,120.6473079,24.13702
高雄市新興區忠孝一路125號,120.3058543,22.6252063
新竹市北區新民里北大路264號,120.963964,24.807636
台北市文山區興隆路3段207-4號,121.559831,24.9949649
基隆市中正區祥豐街131-1號,121.7649528,25.1430023
臺中市南區工學路159號,120.6593915,24.1168021
台北市信義區永吉路54號,121.56941,25.045441
基隆市中山區中山二路59號,121.7404224,25.1381358
高雄市鼓山區興宗里鼓山二路122號,120.2820463,22.6355752
臺中市東區旱溪西路1段40號,120.7006331,24.12722
高雄市左營區博愛二路292號,120.303506,22.662418
高雄市苓雅區中華四路27號,120.3021194,22.6125597
基隆市信義區深溪路139號,121.7825216,25.1345569
新竹市東區府後街1號,120.97031,24.804875
高雄市新興區七賢一路420號,120.3060514,22.6344715
高雄市三民區鳳北里建國三路118號,120.294669,22.637668
臺南市新市區新和里中正路143號,120.2915563,23.0755184
基隆市仁愛區忠四路31號,121.7389918,25.1283564
臺中市大里區中興路2段153-4號,120.6891832,24.1054577
高雄市楠梓區楠都東街209號,120.3267871,22.7264454
高雄市三民區褒揚街218號,120.339916,22.641589
台中市東區建成路662號,120.690529,24.13213
台北市北投區自強街94號,121.5149534,25.1106334
台北市信義區福德街62號,121.580633,25.036943
台中市西屯區西屯路3段164之12號,120.61747,24.18848
高雄市三民區大昌二路305號,120.3317667,22.6477225
台中市北區明德里大雅路353號,120.6733877,24.1693585
台北市萬華區西寧南路275號,121.5063465,25.0391846
高雄市三民區建工路299號,120.332092,22.653365
台中市東區新庄里大公街1號,120.685307,24.1351
臺南市東區崇信里中華東路3段70號,120.2278613,22.9796176
台北市北投區石牌路2段55號,121.5159948,25.116562
高雄市路竹區文南里國昌路136號,120.2528587,22.8577114
台北市萬華區中華路2段424號,121.5061149,25.0275451
台北市信義區松山路484之5號,121.5778689,25.0389169
新竹市東區豐功里建功一路166號,120.9963435,24.801647
臺中市西屯區河南路二段429號,120.6435928,24.1705302
高雄市苓雅區光華一路148-95號,120.3149565,22.6262041
高雄市三民區大昌二路98.100號,120.3322478,22.6431784
基隆市中正區義一路13號,121.7452298,25.1325341
台中市西屯區逢甲里福興路591號,120.6462503,24.175334
高雄市楠梓區興楠路303號,120.332734,22.729348
新竹市興南里興南街59號,120.9625008,24.8023172
台北市北投區北投路2段11號,121.498764,25.1305339
基隆市七堵區開元路59-1號,121.7138366,25.0962048
台北市萬華區中華路2段376-1號,121.5049942,25.0287898
台中市北區中清路一段617號,120.6715151,24.172862
台北市信義區崇德街35號,121.55403,25.024425
高雄市左營區華夏路708號,120.3022713,22.6779064
高雄市左營區左營大路514-6號,120.295529,22.6894351
高雄市新興區復興一路44號,120.3082462,22.6302224
台中市西區美村路1段588號,120.661556,24.1379006
臺中市北屯區崇德路二段135號,120.685317,24.172969
高雄市三民區力行路108號,120.288512,22.638926
臺中市豐原區圓環北路一段319-1號,120.7193461,24.2582524
台北市中正區南昌路1段78號,121.517267,25.030983
臺中市南屯區大墩南路410號,120.6499213,24.1361513
高雄市前鎮區瑞岡里瑞隆路367號,120.3311277,22.6053763
高雄市三民區民族一路870號,120.3172251,22.6678876
臺中市西區五權西四街47號,120.6625346,24.1377914
臺中市北區忠明八街32號,120.6704232,24.1633277
台中市東區立德里台中路121號,120.684074,24.1328539
高雄市左營區新莊仔路712巷3號,120.3034862,22.6702836
高雄市左營區華夏路700號,120.3021378,22.6777266
臺南市東區長榮路2段43號,120.2198597,22.9896771
高雄市小港區華昌路115號,120.3626614,22.5842251
新竹市南大里西大路168號,120.9696365,24.7972471
高雄市三民區建興路305號,120.3233156,22.6458514
高雄市左營區華夏路1139號,120.30901,22.684342
高雄市鳳山區自強二路172號,120.327241,22.5970556
台北市文山區興隆路4段121號,121.561432,24.985747
臺南市新營區民治路8-68號,120.320282,23.311176
高雄市三民區陽明路107號,120.341436,22.6396558
高雄市鼓山區華寧路1號,120.293048,22.6664141
台中市北屯區松明街92號,120.6991038,24.1859782
臺南市仁德區仁德里中正路3段1號,120.2550778,22.9751313
高雄市鹽埕區大公路98．100號,120.2825141,22.62789
新竹市北區文雅里中正路317號,120.9628443,24.8139752
高雄市左營區華夏路1573號,120.315657,22.689049
台北市萬華區東園街66巷37弄58號,121.495011,25.026373
台北市中正區新生南路1段54巷9號,121.5319785,25.0413811
台北市信義區忠孝東路5段396號,121.574627,25.040719
臺中市大雅區神林南路197巷55-9號,120.6552415,24.2280378
基隆市仁愛區南榮路143號,121.7430503,25.1246414
台北市文山區羅斯福路5段170巷1-3號,121.5383665,25.0044488
高雄市三民區灣中里鼎山街581號,120.317455,22.651048
高雄市左營區文德路2號,120.3111751,22.6691473
高雄市前鎮區鄭和路45號,120.313533,22.60748
台中市南區永興里高工路258號,120.6647246,24.1136172
台中市西區安龍里林森路239號,120.667888,24.1397899
臺南市麻豆區穀興里三民路2-6號,120.2456595,23.1842025
高雄市楠梓區興楠路342、344號,120.331773,22.729361
高雄市鼓山區美術東四路327號,120.290103,22.6609063
基隆市仁愛區劉銘傳路11巷10號,121.751335,25.1274446
臺中市南屯區永春東路341號,120.647637,24.1344099
台中市北區新北里三民路三段210–2號,120.6858504,24.1535871
台中市西區永龍里英才路509號,120.6631289,24.1430604
台中市南區復興里復興路三段235號,120.6734909,24.130385
台中市北屯區舊社里崇德路二段297號,120.6856233,24.1773066
臺中市北區賴福里進化北路378之33號,120.6786603,24.1633436
高雄市三民區熱河一街333號,120.307007,22.643552
新竹市水田里經國路二段93號,120.9654404,24.812109
台中市南區復興路2段38-38之1號,120.6602758,24.1196603
基隆市仁愛區孝四路7號,121.7384258,25.1303822
台北市萬華區萬大路284號,121.5003061,25.0254883
高雄市前鎮區瑞北路88號,120.333543,22.609212
新竹市東區建功一路64號,120.997987,24.7982751
高雄市小港區二苓里漢民路232號,120.351997,22.565812
台北市信義區永吉路30巷148弄6號,121.568465,25.042623
臺中市南屯區河南路4段362號,120.6394716,24.1437361
高雄市鼓山區美術東四路325號,120.2903114,22.6610866
高雄市新興區興昌里六合一路46號,120.310942,22.6325185
臺南市安南區安和里安和路一段40號,120.215212,23.026781
高雄市鳳山區保泰路152號,120.3300461,22.6003546
臺南市永康區安康里中華西街44號,120.2272603,23.01355
台中市南屯區春社里忠勇路43-2號,120.6126846,24.1392824
台中市中區繼榮里民權路64號,120.6809714,24.137311
高雄市楠梓區興楠路295．297號,120.332934,22.729446
台中市南屯區黎明路1段936號,120.6365641,24.1352151
高雄市前鎮區后安路263號,120.3209262,22.5721819
臺南市安平區平安里民權路四段141號,120.1825656,22.9990778
新竹市東區中華路二段304號,120.9748501,24.804046
臺中市大里區成功二路100號,120.704253,24.094616
基隆市中山區安一路63號,121.736202,25.131171
高雄市苓雅區海邊路29號,120.293179,22.615809
台北市北投區石牌路2段99巷55號,121.5167806,25.1184407
台中市南屯區公益路二段362．366號,120.6359268,24.1515676
高雄市三民區灣成里明誠一路389．391號,120.3230236,22.6601292
台中市西屯區何德里漢口路二段318號,120.6648384,24.1666925
高雄市苓雅區光華一路148之99號,120.315135,22.625884
臺南市東區崇善里仁和路76-8號,120.2306937,22.9754144
高雄市前鎮區三多三路95號,120.311387,22.616098
新竹市東區復興里經國路一段379巷8號,120.9790309,24.8143182
高雄市三民區陽明路107號,120.341436,22.6396558
高雄市三民區聯興路117號,120.3142455,22.6582125
臺中市東勢區中寧里豐勢路496號,120.828231,24.257799
台中市南屯區溝墘里大隆路119號,120.6512229,24.157043
臺中市西屯區國安1路115號,120.6086738,24.1944167
高雄市鼓山區裕誠路1025號,120.3016639,22.665718
台北市中正區金山南路1段127號,121.5277302,25.0356306
台北市萬華區中華路2段598-4號,121.5094579,25.0247504
台中市西屯區西屯路2段282之22號,120.643431,24.176724
高雄市苓雅區成功一路210–1號,120.2967517,22.6169657
基隆市七堵區南興路10號,121.7148579,25.0976804
高雄市苓雅區大順三路197號,120.3260672,22.6347237
新竹市東區軍功里建新路20號,120.996647,24.797975
新竹市東區建功一路2號,120.9984677,24.7966923
臺中市大肚區沙田路二段614號,120.5455466,24.1502518
新竹市北區民富里經國路二段485號,120.9563151,24.8057873
台北市萬華區長沙街2段82號,121.505115,25.040406
高雄市鼓山區中華一路970號,120.2919189,22.6549735
台中市西屯區西屯路2段27之3號,120.6608603,24.1639628
台北市信義區信義路6段77號,121.577154,25.035679
台中市北區錦南街42-1號,120.687602,24.154521
高雄市苓雅區建國一路336號,120.3247776,22.6329753
台中市西屯區長安路2段1號,120.6609087,24.1725627
台北市文山區羅斯福路6段136號,121.5407119,24.996752
台北市信義區永吉路432號,121.578063,25.0452489
台中市南區復興路一段368號,120.6564457,24.1158065
台北市中正區羅斯福路2段40號,121.5214269,25.0280636
高雄市鹽埕區育仁里大禮街60-1號,120.287739,22.622208
台中市西屯區東興路3段315號,120.6542253,24.1565746
新竹市東區三民里民族路20鄰166號,120.972049,24.804826
高雄市燕巢區中民路665之4號,120.358944,22.7931151
新竹市東區建功一路59巷22號,120.9956446,24.8005031
台中市南屯區田心里向心南路933號,120.643733,24.136159
新竹市東區關帝里武昌街51號,120.9679606,24.801768
臺中市烏日區中山路一段335號,120.6397186,24.1082252
台中市北屯區興安路一段335號,120.694401,24.1743528
高雄市三民區鼎西里鼎力路116號,120.322051,22.665257
高雄市前鎮區保泰路427號,120.3361135,22.6042236
高雄市左營區富民路299號,120.3050415,22.6640437
台中市北區中清路1段798號,120.6719286,24.1716784
基隆市仁愛區仁四路19巷7號,121.742389,25.1272572
高雄市楠梓區德祥路149號,120.3092768,22.7265938
高雄市新興區漢民里中山一路18-1號,120.301941,22.628489
臺南市中西區西華南街26號,120.2094586,22.9935798
台北市文山區興隆路3段204號,121.5589975,24.9977648
高雄市前鎮區中華五路993號,120.305884,22.602623
高雄市鳳山區龍成路10號,120.3301184,22.5949694
台中市北區錦祥里進化路625-5號,120.6938359,24.1608454
高雄市新興區開封路31號,120.311368,22.628339
高雄市新興區五福二路68號,120.308842,22.62597
高雄市仁武區仁雄路89-6號,120.3438318,22.6768136
高雄市前鎮區永豐路91．93號,120.3333494,22.6059361
台北市文山區羅斯福路5段223號,121.5390554,25.0020387
台中市西區忠明里美村路1段105號,120.661894,24.152429
台北市文山區興隆路4段99號,121.560435,24.9883209
高雄市前鎮區草衙里草衙二路385號,120.322241,22.578366
臺中市西區忠明里館前路18號,120.665266,24.1557861
臺中市北屯區崇德路2段135號,120.685317,24.172969
基隆市安樂區基金一路133-4號,121.7113906,25.1403154
臺南市中西區天后里西門路二段396號,120.2008536,22.9987824
台中市北區民權路353號,120.6703309,24.1563067
台中市北區中清路一段448、450、462號,120.6733555,24.1669116
基隆市中正區義一路62號,121.7459761,25.1330701
台北市萬華區西園路1段200號,121.499159,25.035972
高雄市苓雅區三多二路81號,120.3256452,22.6206818
高雄市三民區大昌二路109號,120.3320095,22.6415406
台北市文山區羅斯福路6段455巷11號,121.540313,24.9901959
台北市中正區濟南路2段47號,121.5306715,25.0406224
台北市萬華區西園路2段250號,121.4948197,25.0280431
臺中市龍井區遊園南路266號,120.5836052,24.1807385
高雄市鼓山區內惟里九如四路1191號,120.280227,22.6607816
臺中市西屯區何源里重慶路431號,120.6658229,24.171226
台中市中區東墩里三民路三段41號,120.6821775,24.1455329
高雄市三民區建國三路144號,120.294285,22.637512
高雄市苓雅區四維四路65號,120.298958,22.615346
高雄市左營區明誠二路362號,120.307225,22.6613009
高雄市楠梓區加昌路241號,120.3139877,22.7211129
臺中市霧峰區中正路1100號,120.6993128,24.0693123
新竹市東區東大路一段118號,120.9739336,24.8060649
台北市信義區莊敬路435號,121.566949,25.027193
臺中市北區英才路286號,120.6711177,24.1558921
台中市南屯區東興路2段243號,120.6528463,24.1427734
高雄市新興區六合路183號,120.314101,22.632089
高雄市仁武區文武里中正路301號,120.3486515,22.7402886
臺南市永康區東橋1路156號,120.2242578,23.0198163
臺南市永康區埔圍里永大路三段411號,120.2628111,23.0211779
台北市信義區永吉路344號,121.576243,25.045297
基隆市七堵區福二街198號,121.69625,25.0834744
臺中市大甲區中山路1段971之1號,120.6270874,24.3456464
高雄市小港區孔鳳路571號,120.358628,22.584076
新竹市北區台溪里林森路297號,120.9612108,24.7970644
台中市北區忠太東路58-12號,120.668236,24.1625899
高雄市三民區自立一路267號,120.296143,22.64249
台中市北屯區平安里熱河路二段57號,120.687136,24.1695619
高雄市苓雅區建國一路169-5號,120.3268555,22.6327561
高雄市苓雅區昇平街37號,120.2977504,22.6176355
台中市西區南屯路1段30號,120.667595,24.132361
高雄市苓雅區三多二路283號,120.3199529,22.6188024
台中市西屯區逢甲路233號,120.6410425,24.1763428
高雄市楠梓區右昌街213號,120.2890792,22.7119848
高雄市三民區聯興路131號,120.3140472,22.6588125
新竹市北區中正路321號,120.96249,24.8141021
新竹市東區光復路一段320號,121.01907,24.7829031
高雄市左營區博愛二路6號,120.3032809,22.6565184
台中市北區文莊里篤行路285號,120.673443,24.153307
高雄市左營區華夏路729號,120.3022467,22.6785219
台北市信義區永吉路213號,121.5738481,25.045767
臺中市西區公正里向上路1段437號,120.6542169,24.1466294
台中市西區公益路252號,120.654839,24.151237
臺中市大里區中投西路3段215號,120.6641847,24.0913659
高雄市三民區民族一路521號,120.316238,22.665224
台中市南屯區大墩路186號,120.6499311,24.1414983
台中市北屯區平順里文心路四段753號,120.690379,24.171995
臺中市東區力行路200巷32號,120.69679,24.150879
高雄市左營區民族一路1028-11號,120.320197,22.683349
台中市西區向上路一段361號,120.656083,24.146437
高雄市新興區忠孝一路249號,120.3059028,22.6313866
高雄市旗山區延平一路722-5號,120.4832021,22.8831604
高雄市苓雅區建國一路15-1號,120.3405448,22.6288707
台北市萬華區萬大路144號,121.5003665,25.0288895
高雄市鼓山區中華一路970號,120.2919189,22.6549735
新竹市東區中央路128號,120.9709025,24.8069698
台中市西屯區黎明路三段342號,120.638915,24.1819839
高雄市大寮區中庄里仁愛路82號,120.3730731,22.622786
高雄市左營區崇德路287-289號,120.303317,22.675803
台中市西屯區西安里西屯路二段298–8號,120.6412016,24.1788259
高雄市小港區三苓里二苓路250號,120.347674,22.56557
高雄市新興區中山一路253號,120.301991,22.635156
臺南市下營區和平街16號,120.264035,23.2375818
高雄市三民區嫩江街84號,120.298554,22.643287
新竹市東區公園路280號,120.9793839,24.8030388
高雄市三民區十全一路223號,120.307256,22.644838
台中市北區錦和里三民路3段221號,120.674583,24.1629451
台北市萬華區長沙街2段119號,121.503489,25.0405279
臺中市南屯區大進街449號,120.6512832,24.1514774
高雄市前鎮區光華二路437號,120.317771,22.61778
高雄市新興區復興一路22號,120.308185,22.628995
新竹市東區福德里中華路二段727號,120.9646418,24.7975927
